Crime ID,Month,Reported by,Falls within,Longitude,Latitude,Location,LSOA code,LSOA name,Outcome type
93e3ab906b2de62bf7524c309013d834ca4a38a10105025a564375fbf77d08a8,2016-11,Durham Constabulary,Durham Constabulary,-1.536977,54.531030,On or near SHELLEY ROAD,E01012342,Darlington 009C,Offender given a caution
8c9f561d4619edc66259055a765454cb3773849ba108d05ff7f86074e1a0847c,2016-11,Durham Constabulary,Durham Constabulary,-1.572817,54.857172,On or near Parking Area,E01020595,County Durham 013B,Offender given a caution
4bac4e892873b40b454ac55f3c95678cd71ba2be1c9acc603d5c9092ad5087c5,2016-11,Durham Constabulary,Durham Constabulary,-1.473578,54.546408,On or near THE ORCHARD,E01012366,Darlington 001D,Offender given a caution
d57f3e7bf7185a6934b662b578bf805345e51aa26df7fb2da98278daa3834117,2016-11,Durham Constabulary,Durham Constabulary,-1.815235,54.841562,On or near Sports/Recreation Area,E01020651,County Durham 012B,Offender given a caution
7e63548c57fa62be54151b904de5cd07e30756a95020465339ebcda3445a15e7,2016-11,Durham Constabulary,Durham Constabulary,-1.555149,54.525382,On or near PREBEND ROW,E01033484,Darlington 008F,Suspect charged
7560358212680cc63a5c08c1cd1f55193fbd7e0581abd2b2dbdc0509f2912e07,2016-11,Durham Constabulary,Durham Constabulary,-1.556417,54.689127,On or near MAIN STREET,E01020808,County Durham 050D,Unable to prosecute suspect
ab664c1eb6595580a86ef593afc56687a13dfeb5626b776434cf563c3e6dd867,2016-11,Durham Constabulary,Durham Constabulary,-1.555571,54.523532,On or near HOUNDGATE,E01033484,Darlington 008F,Suspect charged
be0cf7bff4c10addb4213e2b1596476c2e65c1d1a46ef8238237e674793976a9,2016-11,Durham Constabulary,Durham Constabulary,-1.646825,54.624728,On or near SOUTH STREET,E01020802,County Durham 059B,Unable to prosecute suspect
97fcaa0154e5a8947ba5cd9072838468594e467ad37f696c389f7b4ae0919c56,2016-11,Durham Constabulary,Durham Constabulary,-1.576276,54.538210,On or near LAING STREET,E01012311,Darlington 006C,Further investigation is not in the public interest
4d76621e4e742422f1cf59617c52b27f65af528793f2ca449262c07edcd46543,2016-11,Durham Constabulary,Durham Constabulary,-1.611759,54.873460,On or near SANDYFORD,E01020616,County Durham 005C,Unable to prosecute suspect
38ee8bd4c89cbd4feaf4f251c76c47b1f56be9a2d80961baff0a3412079f15de,2016-11,Durham Constabulary,Durham Constabulary,-1.544110,54.517720,On or near WINDERMERE COURT,E01012340,Darlington 012D,Unable to prosecute suspect
e260f326bd77264244bdb56679e3b16232266d4f5249fbf18f3ca34fbda2e79c,2016-11,Durham Constabulary,Durham Constabulary,-1.410531,54.717299,On or near ST PAUL'S ROAD,E01020827,County Durham 048E,Investigation complete; no suspect identified
79805e3e0963fb98b48266dd5018a73d1845f03ffa04bfbfdb1ec94c059e93fd,2016-11,Durham Constabulary,Durham Constabulary,-1.544302,54.837244,On or near Supermarket,E01020609,County Durham 015D,Unable to prosecute suspect
78668e7697d544bd0ac475d56afd7b852094965af9218468a635df3b6643587a,2016-11,Durham Constabulary,Durham Constabulary,-1.529139,54.741965,On or near A177,E01020694,County Durham 041A,Offender given a caution
2745932e2932cc7b8bb3939af8f48d532dec36dd48a3f180f63efb4803d35789,2016-11,Durham Constabulary,Durham Constabulary,-1.674579,54.665570,On or near Shopping Area,E01020868,County Durham 055A,Suspect charged
48ee34866881b78ec677047582ef455ef89e026077be6b0392accb57f43f9bff,2016-11,Durham Constabulary,Durham Constabulary,-1.568366,54.621464,On or near Supermarket,E01020831,County Durham 062B,Offender given penalty notice
fa118fcbce4125134dc456e5088f24b0e03bee38415dad385ab79b75ec392820,2016-11,Durham Constabulary,Durham Constabulary,-1.820882,54.751103,On or near PENNINE VIEW,E01020892,County Durham 045D,Investigation complete; no suspect identified
31a046639b3598f47be5081713eb2a09edfdf8ac16766dee5568b381ad957e1f,2016-11,Durham Constabulary,Durham Constabulary,-1.419276,54.738640,On or near WINGATE LANE,E01020790,County Durham 040C,Investigation complete; no suspect identified
66101881ceeb9a41caaddfb6b1f48100a8fb6a79b5f16d81768b50f8ba584cdf,2016-11,Durham Constabulary,Durham Constabulary,-1.838791,54.850114,On or near PONDS COURT,E01020644,County Durham 014D,Unable to prosecute suspect
496933d3e2181a4fc926cd54a057dc543471b73151cd0d295dec3325f4aa2b73,2016-11,Durham Constabulary,Durham Constabulary,-1.827997,54.853981,On or near GLADSTONE STREET,E01020641,County Durham 010C,Investigation complete; no suspect identified
e97b58137a66351fc7e2c310843d3fafcd9f855e7c4e2b6e1e0f9e9c5320efac,2016-11,Durham Constabulary,Durham Constabulary,-1.561622,54.532631,On or near BEACONSFIELD STREET,E01012353,Darlington 008B,Unable to prosecute suspect
4e119af5be62a094f2bd261199e65b5108672677dc784269cd78c961bfaf96f8,2016-11,Durham Constabulary,Durham Constabulary,-1.387246,54.764615,On or near Parking Area,E01020761,County Durham 034B,Unable to prosecute suspect
2462cd3f6fc63d27d4b58e14f35760cbce334efdc49025836e4c24b754e28068,2016-11,Durham Constabulary,Durham Constabulary,-1.745758,54.717395,On or near WILSON STREET,E01020877,County Durham 046A,Suspect charged
98f595528be12754d468e1be69060dda82c1e418e4482f1850d8d45274f75c78,2016-11,Durham Constabulary,Durham Constabulary,-1.681939,54.648263,On or near WAINE CRESCENT,E01020907,County Durham 058C,Suspect charged
fd207ac910b7afc4bc3b089b98990de82efe3d4071c0989d6db7b5e53b6a945c,2016-11,Durham Constabulary,Durham Constabulary,-1.552799,54.529768,On or near NORTHGATE,E01033483,Darlington 008E,Investigation complete; no suspect identified
875bd9c74df5067482f3ad5de6109a2d394562a114c761658634ec758f669755,2016-11,Durham Constabulary,Durham Constabulary,-1.543256,54.512603,On or near WORTON DRIVE,E01012317,Darlington 013A,Unable to prosecute suspect
12b44444fcbd6f1d8ff4abfe0161cec336799ce502cb8d170b22a684b9c6bd6f,2016-11,Durham Constabulary,Durham Constabulary,-1.553314,54.547726,On or near LONGFIELD ROAD,E01012323,Darlington 002C,Unable to prosecute suspect
fc01190114c67857d7a0459693cd2cc08fd173771c61e636ed0c4f5980e67f4e,2016-11,Durham Constabulary,Durham Constabulary,-1.604702,54.696151,On or near DRAKE STREET,E01020835,County Durham 052D,Unable to prosecute suspect
b32b49b9e930d94d4479099b7fed2d9ae8b465c3f8dcabb644ed74ab54e37487,2016-11,Durham Constabulary,Durham Constabulary,-1.439306,54.748044,On or near ST CUTHBERT ROAD,E01020789,County Durham 040B,Investigation complete; no suspect identified
4080cc8fa412e42678cee464cf69e31d5a602c58d8b887d5fa7cab637a114ae3,2016-11,Durham Constabulary,Durham Constabulary,-1.415405,54.718392,On or near LUKE STREET,E01020792,County Durham 040E,Local resolution
fef0ba325a859a086d5f4e296fb449c78958c8079b6688b26fb1ba3d4046126d,2016-11,Durham Constabulary,Durham Constabulary,-1.555737,54.523919,On or near Shopping Area,E01033484,Darlington 008F,Offender given penalty notice
cd17111bd1babe9d1f099ebc7e53906eba79898b154aefe8db0df22b2bb5c166,2016-11,Durham Constabulary,Durham Constabulary,-1.573855,54.856196,On or near FRONT STREET,E01020595,County Durham 013B,Investigation complete; no suspect identified
f153f10712a898c91fab7b4d1c98af67b26a0b0ba206bd69e8788ceec97e4915,2016-11,Durham Constabulary,Durham Constabulary,-1.377830,54.724918,On or near JOHNSON'S STREET,E01020795,County Durham 043D,Investigation complete; no suspect identified
7d8b386be8fd3b6688b4e2227c75f293e3350b6b2e3594b4e13bbdef17b91ff5,2016-11,Durham Constabulary,Durham Constabulary,-1.608093,54.753227,On or near LITTLEBURN ROAD,E01020684,County Durham 033A,Investigation complete; no suspect identified
92133ff6c3bcd817b4e92c7aa3ab3b56d40cdafed1e0560363ac77679e4a0b61,2016-11,Durham Constabulary,Durham Constabulary,-1.472086,54.513437,On or near THORNTREE GARDENS,E01012346,Darlington 015E,Unable to prosecute suspect
ef825a0d5af466cfb3409ccec7872f9de30a40a6647b87ca2ea6d32fec6743c9,2016-11,Durham Constabulary,Durham Constabulary,-1.869853,54.838217,On or near Sports/Recreation Area,E01020645,County Durham 014E,Unable to prosecute suspect
596d54263db126760b7796b967a3faacfd836a50c62ee90ce2e264feb1416241,2016-11,Durham Constabulary,Durham Constabulary,-1.334387,54.837641,On or near TYNE STREET,E01020784,County Durham 017F,Suspect charged
092d9a63434106886b1b6f9b1febaba892d214d247ec27a43d1ab91a807ab7e3,2016-11,Durham Constabulary,Durham Constabulary,-1.385372,54.818553,On or near HENRY STREET SOUTH,E01033198,County Durham 021E,Investigation complete; no suspect identified
f1301db58274b5bb39f462927b60e8e3704466b3d8a13293bc8861cfa0d93e4f,2016-11,Durham Constabulary,Durham Constabulary,-1.639533,54.629623,On or near CHESTNUT CLOSE,E01020841,County Durham 059F,Investigation complete; no suspect identified
6dbc49abd38b47068c63a9c96d0aede68ddaa9021c667cb416a636ec0aee9ed4,2016-11,Durham Constabulary,Durham Constabulary,-1.592928,54.788890,On or near Hospital,E01020702,County Durham 033B,Unable to prosecute suspect
9ef3349232a500cc320c580589b9b51d26175f31040c624e603ccdb9f49eb5dc,2016-11,Durham Constabulary,Durham Constabulary,-1.438789,54.765233,On or near BARNARD AVENUE,E01020729,County Durham 027D,Investigation complete; no suspect identified
a85f420404b664900c433c0792cbbd9aa4e39ab123dd8a1459698ade6808212b,2016-11,Durham Constabulary,Durham Constabulary,-1.531983,54.540734,On or near BAMBURGH PLACE,E01012333,Darlington 005D,Investigation complete; no suspect identified
3a961009b34c5ca81f67d7c5ce102a9f3723b1c06998aae4c85284a342799367,2016-11,Durham Constabulary,Durham Constabulary,-1.334051,54.830594,On or near DAWDON CRESCENT,E01020742,County Durham 017C,Unable to prosecute suspect
2754aeacce0b9473236bde1fe39e4baf394870ce32306be5947867912eed0b5f,2016-11,Durham Constabulary,Durham Constabulary,-1.568366,54.621464,On or near Supermarket,E01020831,County Durham 062B,Unable to prosecute suspect
821281a489b9760bcb9f359ea5262749def1bd40ec3137f3968119c206a34325,2016-11,Durham Constabulary,Durham Constabulary,-1.573855,54.856196,On or near FRONT STREET,E01020595,County Durham 013B,Investigation complete; no suspect identified
1cc75f966ff57af7fc8b1696ace6ade88ee87ca19b7a229a812bf720d53466fd,2016-11,Durham Constabulary,Durham Constabulary,-1.808107,54.860503,On or near TINDALE STREET,E01020668,County Durham 012D,Investigation complete; no suspect identified
a56400e3e007306d0f73c76fd00b6d84c1a8cd833ee65b45cfc4121423e201da,2016-11,Durham Constabulary,Durham Constabulary,-1.355986,54.760041,On or near FURNESS CLOSE,E01020771,County Durham 035E,Investigation complete; no suspect identified
e7112ef72a4bbc4bf1aef951afb36576d9dd3eba8ca26cb6285ce594a0da8024,2016-11,Durham Constabulary,Durham Constabulary,-1.524407,54.539626,On or near BISHOP CLOSE,E01012326,Darlington 005B,Unable to prosecute suspect
b7c18f3891ea46a6659133ac7c7ffa80976cf25234570ba786c8b1ea07ad0927,2016-11,Durham Constabulary,Durham Constabulary,-1.576365,54.858990,On or near SOUTH BURNS,E01020598,County Durham 007C,Offender given penalty notice
95f5cb8a4ee19fed957a0ef05b7e7a22ee61d746abe6569901a7e877631790cb,2016-11,Durham Constabulary,Durham Constabulary,-1.827997,54.853981,On or near GLADSTONE STREET,E01020641,County Durham 010C,Investigation complete; no suspect identified
68d3875d074332a339f42198a85a2a8ce04ea4fd8202f42b6cc2fa030080fe38,2016-11,Durham Constabulary,Durham Constabulary,-1.581064,54.806840,On or near Shopping Area,E01020709,County Durham 022A,Suspect charged
555353d9b9b77992531476f6cc12d5b6b9332eec06335ca4a242e89b7d63e9f5,2016-11,Durham Constabulary,Durham Constabulary,-1.588449,54.615602,On or near ROWAN PLACE,E01020844,County Durham 061B,Suspect charged
eb39d2da8e69979956d19fe43948e3a42314665fe566bbd5fed205dc4e1e7812,2016-11,Durham Constabulary,Durham Constabulary,-1.424190,54.741476,On or near QUETLAW ROAD,E01020790,County Durham 040C,Investigation complete; no suspect identified
f819c19630037b3da73673f3a16ff85be6bb8b1df0d523d7cd953fec3ea4fe8d,2016-11,Durham Constabulary,Durham Constabulary,-1.655281,54.632122,On or near CLARENDON COURT,E01020802,County Durham 059B,Suspect charged
d1d0740ff6e8d9d1a0709c61db7ea5e17944ab36a42b4ec25b9d7dbd9194b86c,2016-11,Durham Constabulary,Durham Constabulary,-1.746017,54.708185,On or near BEECHWOOD LANE,E01020877,County Durham 046A,Investigation complete; no suspect identified
5e44a8645da72702fb97cfe493ff256cd946e7469d0257a418328fedcc5e45bc,2016-11,Durham Constabulary,Durham Constabulary,-1.322758,54.788222,On or near B1283,E01020752,County Durham 025B,Unable to prosecute suspect
bfe81ea94e5caae137d2d4628fa2a4dae500823f5b607ede8e92ad8dc9280283,2016-11,Durham Constabulary,Durham Constabulary,-1.591419,54.540105,On or near BERWICK ROAD,E01012313,Darlington 006E,Unable to prosecute suspect
a7e6488eef558c9713e2e4c2d9f02c155ce886497a583f3a4079ae8ce8c481b1,2016-11,Durham Constabulary,Durham Constabulary,-1.328993,54.762905,On or near LAKELAND DRIVE,E01020758,County Durham 032D,Investigation complete; no suspect identified
1a5197a24abbd2fdfbbe4950e0fceb157fa7ffc8fd841efbd71a69ae681fbdc3,2016-11,Durham Constabulary,Durham Constabulary,-1.582290,54.888576,On or near Pedestrian Subway,E01008174,Gateshead 026C,Investigation complete; no suspect identified
8a376674154d9ca4037ed6cb0efc9ee61d84efa4f456955347eaf7b6bce36557,2016-11,Durham Constabulary,Durham Constabulary,-1.880879,54.731505,On or near SILVER STREET,E01020905,County Durham 042D,Unable to prosecute suspect
567aa5016010398b3a8c67c9b5a210e86512176ed8bd877f984a7b925a494dd7,2016-11,Durham Constabulary,Durham Constabulary,-1.527517,54.515257,On or near BURNSIDE ROAD,E01012318,Darlington 013B,Investigation complete; no suspect identified
20e20c188ff86bdefc8f6d3dc012bf3ab29401897462574d4ed31aed0f0cf4bf,2016-11,Durham Constabulary,Durham Constabulary,-1.593279,54.701163,On or near ST ANDREW'S LANE,E01020820,County Durham 049C,Investigation complete; no suspect identified
89c5945524d5e76c7eeceb99efe8380f523e32c8374c9a67144a4c1985376350,2016-11,Durham Constabulary,Durham Constabulary,-1.558048,54.533068,On or near BARTLETT STREET,E01012353,Darlington 008B,Unable to prosecute suspect
e5e1319460952d6c6999a3a64925f4113e93ddd4ce2fce679065a9a6f3254bff,2016-11,Durham Constabulary,Durham Constabulary,-1.572202,54.778313,On or near CLAYPATH,E01033164,County Durham 030D,Investigation complete; no suspect identified
ad335ef741243a9603add1458bc6dd8797a614ba63678d3083a84b6a160b6403,2016-11,Durham Constabulary,Durham Constabulary,-1.332928,54.760824,On or near Pedestrian Subway,E01020746,County Durham 037A,Investigation complete; no suspect identified
77ebd988728b61de9bba5d3a99d550c1a64d09440380a05777b6e24e384b4df6,2016-11,Durham Constabulary,Durham Constabulary,-1.681939,54.648263,On or near WAINE CRESCENT,E01020907,County Durham 058C,Suspect charged
a236d34993694a2bbf6fbdb594211c349215e0fd3e86ca7bc64237bdfdc0673f,2016-11,Durham Constabulary,Durham Constabulary,-1.364629,54.834298,On or near ESSEX CRESCENT,E01020748,County Durham 018C,Unable to prosecute suspect
c3c1499b5fd3e3c5ec120aaa91a7536cf8c01ffee9b0215a183ad6374a14b204,2016-11,Durham Constabulary,Durham Constabulary,-1.334387,54.837641,On or near TYNE STREET,E01020784,County Durham 017F,Suspect charged
4e97178cbbacb28a66a9d26c75cb7b6c5e0ce3b86621f06fd2d1445f0894bc15,2016-11,Durham Constabulary,Durham Constabulary,-1.344284,54.829311,On or near ASPEN GROVE,E01020743,County Durham 018A,Unable to prosecute suspect
f95ebb682c6a74c751452bc041cf03ba7dfad3b0211bd8b21616edcd374d9311,2016-11,Durham Constabulary,Durham Constabulary,-1.345301,54.828022,On or near ALDER GROVE,E01020743,County Durham 018A,Unable to prosecute suspect
296815e66026ac34dc501b5ec4e3896dcd3ae1027f5a5f59cd760b93f0cad313,2016-11,Durham Constabulary,Durham Constabulary,-1.643497,54.624512,On or near BERESFORD STREET,E01020802,County Durham 059B,Unable to prosecute suspect
55b94421319fb5ee65b940d283791c4e743a73e0eecc504c772e677bb0588a6a,2016-11,Durham Constabulary,Durham Constabulary,-1.568096,54.686419,On or near PAXTON STREET,E01020806,County Durham 049A,Unable to prosecute suspect
e621fe68d26f6af10b3918090ad164e733008b4fe23e261c012c8f878712cdc9,2016-11,Durham Constabulary,Durham Constabulary,-1.834574,54.849264,On or near Supermarket,E01020640,County Durham 010B,Suspect charged
ec28d56e31ee2a5cd2434d92f24a65174bfd655f058f8566e1fa4e3f6e452a44,2016-11,Durham Constabulary,Durham Constabulary,-1.540876,54.518193,On or near THIRLMERE ROAD,E01012340,Darlington 012D,Suspect charged
fc9ae0c3e3280c5553000579bc5f2612190a59944569afd6fee9569243c881c5,2016-11,Durham Constabulary,Durham Constabulary,-1.681939,54.648263,On or near WAINE CRESCENT,E01020907,County Durham 058C,Suspect charged
381189aed6f2c71ede53a7deacccd5ccb6e235c9f75fa0ed6cc0cb1f2d83c6cf,2016-11,Durham Constabulary,Durham Constabulary,-1.334051,54.830594,On or near DAWDON CRESCENT,E01020742,County Durham 017C,Unable to prosecute suspect
9ea39c5654fc67ca9affb584e1d30a0e7965c2c0e58a2d42358a90a068256aef,2016-11,Durham Constabulary,Durham Constabulary,-1.333511,54.765977,On or near ROBSON AVENUE,E01020757,County Durham 032C,Investigation complete; no suspect identified
872702c16c721a2a2b4ecfacd08a28c0eedd1549894dd08de45189113c9bfee0,2016-11,Durham Constabulary,Durham Constabulary,-1.556359,54.537753,On or near WHESSOE ROAD,E01012349,Darlington 004A,Investigation complete; no suspect identified
a763660f6d40fa3ddecce5a2d5ee4cc299d13efd1531137593560ed5d8f3f510,2016-11,Durham Constabulary,Durham Constabulary,-1.648577,54.633460,On or near PRIMITIVE STREET,E01020838,County Durham 059C,Suspect charged
8da46147acfedf4bc8463bf39bf098cd86efc91d1bcdc690acb4bc148a11e607,2016-11,Durham Constabulary,Durham Constabulary,-1.834574,54.849264,On or near Supermarket,E01020640,County Durham 010B,Local resolution
dca92a4cd8366e96bbd60de4e8bda65d9927477db224ee9d630b2a111d854772,2016-11,Durham Constabulary,Durham Constabulary,-1.684702,54.649690,On or near RUDDOCK AVENUE,E01020907,County Durham 058C,Unable to prosecute suspect
4ed0da3f9d00ec0d0ec9ba092d827cd8123321074349f615f1ae7b06acea4035,2016-11,Durham Constabulary,Durham Constabulary,-1.625558,54.820402,On or near GREGSON STREET,E01020621,County Durham 019E,Unable to prosecute suspect
52bfd7616e3a9c4ba81db8bf5f8f098cc86159fcb5b6dec668137cd5eeb8483c,2016-11,Durham Constabulary,Durham Constabulary,-1.625452,54.747701,On or near SOUTH VIEW,E01020685,County Durham 038A,Investigation complete; no suspect identified
890aa6764a7fd3467f2714a48111d813a88fa88d2476f4e67f72d405cb234066,2016-11,Durham Constabulary,Durham Constabulary,-1.595261,54.700038,On or near SYCAMORE COURT,E01020820,County Durham 049C,Unable to prosecute suspect
acef1bd016dfce4c6e709d8397ca0ca2339aca2699271a664ee4b059c6fa3545,2016-11,Durham Constabulary,Durham Constabulary,-1.558981,54.661556,On or near HUNTER TERRACE,E01020805,County Durham 053D,Unable to prosecute suspect
270f1b3bcc3941f5bdf3783ef6dbea20e0c0a99b373b059a76ce02e8fe83938a,2016-11,Durham Constabulary,Durham Constabulary,-1.559297,54.516123,On or near Park/Open Space,E01012358,Darlington 014C,Investigation complete; no suspect identified
b8340b97c17a9c096761dd4a27046ddc2d6e8bcea787f22c09dbb9f083a01a4d,2016-11,Durham Constabulary,Durham Constabulary,-1.563713,54.685783,On or near CROMPTON COURT,E01020806,County Durham 049A,Local resolution
53ff8a77c831fcbfad56ecda8ebf8cadcb69582209b834b69e5dc948a9ca4c7b,2016-11,Durham Constabulary,Durham Constabulary,-1.703069,54.772665,On or near FAIR VIEW,E01020705,County Durham 031A,Investigation complete; no suspect identified
6972dc1b6a6acfc51977d28f5bfad098a9ff53efb73b994eef376b24336ea548,2016-11,Durham Constabulary,Durham Constabulary,-1.730865,54.858955,On or near TEESDALE COURT,E01020624,County Durham 009A,Investigation complete; no suspect identified
ae5eab0eb5285ce8c67856bdae8a08a7142acfc72c819ddb5b301da193a92ce7,2016-11,Durham Constabulary,Durham Constabulary,-1.648139,54.766722,On or near DORIC ROAD,E01020715,County Durham 031C,Investigation complete; no suspect identified
05a4c458ae9091fc717e5d3c33c94cb19b1a76982952bc5b4b38509f821bfefb,2016-11,Durham Constabulary,Durham Constabulary,-1.412068,54.799840,On or near JUBILEE SQUARE,E01033206,County Durham 021G,Investigation complete; no suspect identified
fa67d1f094bbe8f4da5a0ae2e14610eca1dd03ebae91f86b01e49afa0c1ac042,2016-11,Durham Constabulary,Durham Constabulary,-1.747419,54.857337,On or near Sports/Recreation Area,E01020625,County Durham 009B,Unable to prosecute suspect
1dd7670ac71ef158c4c305d54117dff912b171c3ae392b0783e978f47927dc82,2016-11,Durham Constabulary,Durham Constabulary,-1.703487,54.860095,On or near CHARLOTTE STREET,E01020672,County Durham 009E,Offender given a caution
b954140156a2be0a3f42728b6d7784697fec4713334de2320176ce8d4e1b26dd,2016-11,Durham Constabulary,Durham Constabulary,-1.644378,54.777423,On or near Supermarket,E01020715,County Durham 031C,Offender given a drugs possession warning
4ad8c0336310100461d30b032b60eb96af9cb94ed584cba15a17ceeeb02d8304,2016-11,Durham Constabulary,Durham Constabulary,-1.567338,54.852435,On or near HOLMLANDS PARK,E01020595,County Durham 013B,Offender given a caution
1b9ad3dd929456aca702a219ec34826059af0ab18075e683b98788adc40eec22,2016-11,Durham Constabulary,Durham Constabulary,-1.703487,54.860095,On or near CHARLOTTE STREET,E01020672,County Durham 009E,Offender given a caution
d4f2b7fec4eeecfb1d980a8aa0030e05c6ad309b90c3399611bbdccd1af610d7,2016-11,Durham Constabulary,Durham Constabulary,-1.533344,54.527089,On or near Sports/Recreation Area,E01012342,Darlington 009C,Investigation complete; no suspect identified
b62626bcf8a4b8e830b0ad0d9a61afa1fcc6182a58d550e7476230bedc9d9a58,2016-11,Durham Constabulary,Durham Constabulary,-1.620011,54.817815,On or near VIOLA CRESCENT,E01020621,County Durham 019E,Unable to prosecute suspect
1c5df3c86360edea15065fe61d89ed42406059b4cfd8ec6c4d33694544516cc7,2016-11,Durham Constabulary,Durham Constabulary,-1.544405,54.684032,On or near BERTHA STREET,E01033203,County Durham 053E,Unable to prosecute suspect
eabc9dfef0f1d1ecc853fba6152a80682fa2cf31b6e4a1f65271781feb691fc0,2016-11,Durham Constabulary,Durham Constabulary,-1.538156,54.779563,On or near RENNY'S LANE,E01020693,County Durham 029A,Investigation complete; no suspect identified
cd5fbc7577e6a6e70702741417470771c56ad4872540d9fa52c881296eb5e787,2016-11,Durham Constabulary,Durham Constabulary,-1.698526,54.871433,On or near BEAMISH STREET,E01020661,County Durham 004A,Investigation complete; no suspect identified
3ecd64d7aaa5e12659fbac09e44d104179ec61de6d8ab80c150a9572a90720ae,2016-11,Durham Constabulary,Durham Constabulary,-1.748113,54.863404,On or near TROWSDALE STREET,E01020638,County Durham 006B,Investigation complete; no suspect identified
abd6b59847fc2076840326fe3662e72e68bf68b8fbd7d006cbc00f57b9ed8518,2016-11,Durham Constabulary,Durham Constabulary,-1.851479,54.860015,On or near ST ANDREW'S CRESCENT,E01020631,County Durham 014B,Investigation complete; no suspect identified
c229a4f10bc447ec5acf4f548af20d0cc2a3cd3140d384fed77c23ab4e119680,2016-11,Durham Constabulary,Durham Constabulary,-1.622794,54.816422,On or near CROSSFIELD,E01020621,County Durham 019E,Unable to prosecute suspect
e133a9bb2e1356355c83b88a4023f03d76651c7905497cde1c4e7400b4056705,2016-11,Durham Constabulary,Durham Constabulary,-1.555164,54.526811,On or near Supermarket,E01033484,Darlington 008F,Investigation complete; no suspect identified
2357fb8e3f88d47ddb6641efd21bda9ba6bbd84a32995310192c9fdc097bfa25,2016-11,Durham Constabulary,Durham Constabulary,-1.721652,54.628644,On or near Sports/Recreation Area,E01020895,County Durham 057C,Unable to prosecute suspect
68f8f26c57241eb4857112d5557dd46a1314138e3dff6b7fb713b01d14b65a8b,2016-11,Durham Constabulary,Durham Constabulary,-1.539853,54.521245,On or near LOUISA STREET,E01012305,Darlington 012B,Unable to prosecute suspect
114ccf9194d68b7d72c2e641e0e93f56653d50aae6ab9de68c6abdc04cf7987e,2016-11,Durham Constabulary,Durham Constabulary,-1.562383,54.533748,On or near WIDDOWFIELD STREET,E01012353,Darlington 008B,Offender given a drugs possession warning
a63b7044c6904423ce84c59a3e9209d295030cd1ca301d27d2af363257001760,2016-11,Durham Constabulary,Durham Constabulary,-1.434906,54.682448,On or near Supermarket,E01020810,County Durham 048B,Offender given a caution
ae472ca26343c6128eb90a14c16980ccf364e186f7df4cf7a3406c948947e6ab,2016-11,Durham Constabulary,Durham Constabulary,-1.441508,54.514172,On or near ASHDALE CLOSE,E01012345,Darlington 015D,Investigation complete; no suspect identified
0018aaa1be4e1322336a3009d73106e14bf10a9db09655ab6d6f5e8f3fd2b7ec,2016-11,Durham Constabulary,Durham Constabulary,-1.313326,54.762054,On or near SIXTH STREET,E01020767,County Durham 036C,Further investigation is not in the public interest
e2864258170d5e4a19cf0af82b8c7c61a153056fd7dd0b2bb3bd5493cc5b7eb4,2016-11,Durham Constabulary,Durham Constabulary,-1.555132,54.482883,On or near TEES VIEW,E01027751,Richmondshire 001B,Formal action is not in the public interest
31c1f2ef3f036d55adeebaf67773509fa8ca175f9d2f9fc6bb8e64d8462dfb6e,2016-11,Durham Constabulary,Durham Constabulary,-1.499730,54.815555,On or near SHEEN CLOSE,E01020726,County Durham 027B,Investigation complete; no suspect identified
9f80be6e695c8db67bae35f4c3900377d2af1c05b53a7d5f8b72d2b63c240a2a,2016-11,Durham Constabulary,Durham Constabulary,-1.544988,54.541539,On or near HOMERTON COURT,E01012351,Darlington 004C,Investigation complete; no suspect identified
ebb6f5bbb67a4d9633ef34b4b99578282d814fd4910f1f91d39695bc859dc9e2,2016-11,Durham Constabulary,Durham Constabulary,-1.557454,54.520861,On or near Supermarket,E01012356,Darlington 014A,Local resolution
536761703e7b10c4088b90d09229dd9f7a1498d700563d148244a05b7f0b4039,2016-11,Durham Constabulary,Durham Constabulary,-1.652616,54.634028,On or near ALBION AVENUE,E01020838,County Durham 059C,Unable to prosecute suspect
58931cf3682908715885b66eb60ffb25679fd9b33e74529d6717347abc6e195c,2016-11,Durham Constabulary,Durham Constabulary,-1.530916,54.523260,On or near THE FAIRWAY,E01012343,Darlington 009D,Investigation complete; no suspect identified
