Crime ID,Month,Reported by,Falls within,Longitude,Latitude,Location,LSOA code,LSOA name,Outcome type
453ffcb29f6c26b103123bda9e00f71d60584561bba87e87688297a98717777a,2016-11,Durham Constabulary,Durham Constabulary,-1.558749,54.529682,On or near FORSTER STREET,E01012355,Darlington 008D,Investigation complete; no suspect identified
3725ed7e77fa10d0e0cabdecbb8ee5c3c78279f865b36e705a853b69728f95c0,2016-11,Durham Constabulary,Durham Constabulary,-1.684058,54.864494,On or near MALVERN TERRACE,E01020647,County Durham 008A,Suspect charged
98edb154fc121cda027518f5bad7c76ff7b51f1ef9c54183e6424a6db775a134,2016-11,Durham Constabulary,Durham Constabulary,-1.653680,54.645481,On or near HIGH STREET,E01020880,County Durham 055D,Offender given a caution
d8d2a8d2aaec741bdc040267ef4f12397db37e26f9ea848880a2407b86e4368b,2016-11,Durham Constabulary,Durham Constabulary,,,No location,,,Suspect charged
25ff23423409f2e181e8e58d8bf264642872471e102164546ad27d6f96fdadf0,2016-11,Durham Constabulary,Durham Constabulary,-1.620011,54.817815,On or near VIOLA CRESCENT,E01020621,County Durham 019E,Offender given a caution
9a2b76786932e582c128b664a62ef3e9452d318328c3ddb64a132c08e9845444,2016-11,Durham Constabulary,Durham Constabulary,-1.685209,54.646241,On or near PROUDFOOT DRIVE,E01020909,County Durham 058E,Unable to prosecute suspect
075c46d39139accc5827ef33a65ebf127aad76e0dfebd096f974aa5f86a01463,2016-11,Durham Constabulary,Durham Constabulary,-1.333012,54.831289,On or near STRANGWAYS STREET,E01020741,County Durham 017B,Unable to prosecute suspect
df542481faec1f5d569e36705ae25720e57ac9f28f6e6f2811676d21dfa1f5c0,2016-11,Durham Constabulary,Durham Constabulary,-1.812573,54.612346,On or near GARDEN HOUSE LANE,E01020856,County Durham 064A,Offender given a caution
c887f90fa7594494163cd3fd9e19094c6f1987c2de83bff768b2d2e4d21f8908,2016-11,Durham Constabulary,Durham Constabulary,-1.580133,54.626241,On or near SID CHAPLIN DRIVE,E01020847,County Durham 061C,Investigation complete; no suspect identified
4e401335fe916503f1d64a3ccd38c9387a5c03ad067c30f0387f44b80c3c7b6f,2016-11,Durham Constabulary,Durham Constabulary,-1.333012,54.831289,On or near STRANGWAYS STREET,E01020741,County Durham 017B,Local resolution
cce5f5234e3eb9985a52ff485bdee9424ed63fc762d3c2f5fc8fa7bcbdb314e5,2016-11,Durham Constabulary,Durham Constabulary,-1.672111,54.652497,On or near TAYLOR ROAD,E01020885,County Durham 058B,Suspect charged
8f56a01cde7cec278ebbb52d9b8a31f00a098e824e30abcd0fa4809cc63de08a,2016-11,Durham Constabulary,Durham Constabulary,-1.333012,54.831289,On or near STRANGWAYS STREET,E01020741,County Durham 017B,Local resolution
fca8c290c67508a542c7d7cb1cba80191f212caa6ac1fd0519ec1a605c4a82bf,2016-11,Durham Constabulary,Durham Constabulary,-1.535645,54.685086,On or near CLEVES AVENUE,E01033203,County Durham 053E,Suspect charged
f1b9c3dcf0f993b0522acda473c3654994c19c8d8cbc522c9c26a7584d65221c,2016-11,Durham Constabulary,Durham Constabulary,-1.618546,54.664247,On or near BUCKINGHAM TERRACE,E01020873,County Durham 051A,Investigation complete; no suspect identified
52fc94a71e6dd8b86696de28ebc6cb4332d9ea70e568134ff443a38a6bb3ae63,2016-11,Durham Constabulary,Durham Constabulary,-1.388581,54.761648,On or near ARDEN STREET,E01020762,County Durham 034C,Investigation complete; no suspect identified
4ed061d956e8a3de17629b2d57c60c80e3d948753ba3a4f922ae9c45b2be9e11,2016-11,Durham Constabulary,Durham Constabulary,-1.810067,54.615209,On or near MEADOWCROFT,E01020856,County Durham 064A,Offender given a caution
4ed061d956e8a3de17629b2d57c60c80e3d948753ba3a4f922ae9c45b2be9e11,2016-11,Durham Constabulary,Durham Constabulary,-1.810067,54.615209,On or near MEADOWCROFT,E01020856,County Durham 064A,Offender given a caution
d1fd16e93058eeedd694c9b351e03463d24a65520670fb227c264a706c1c06b5,2016-11,Durham Constabulary,Durham Constabulary,-1.647356,54.647440,On or near WESLEY STREET,E01020880,County Durham 055D,Investigation complete; no suspect identified
d3004a38c71c2b358dc879643bed31baaba96e8298a0867ebd03634390485203,2016-11,Durham Constabulary,Durham Constabulary,-1.468642,54.517035,On or near STATION ROAD,E01012344,Darlington 015C,Unable to prosecute suspect
b65dcd8027481fa4556b0b38e3be0455bce6c1f57cc18f1bce69f86bacdd39d6,2016-11,Durham Constabulary,Durham Constabulary,-1.642393,54.633828,On or near DENT STREET,E01020839,County Durham 059D,Investigation complete; no suspect identified
2bd7044447c800150dc399ec93e1822e822e0b2da034b26a790361ec3c02a4d6,2016-11,Durham Constabulary,Durham Constabulary,-1.327832,54.762638,On or near KESWICK ROAD,E01020758,County Durham 032D,Unable to prosecute suspect
e588c14bbb433db7c0083250e6d2ffdd8cf34e5286cdfd19ec9013b8028ff59b,2016-11,Durham Constabulary,Durham Constabulary,-1.339092,54.765908,On or near SMILLIE CLOSE,E01020757,County Durham 032C,Investigation complete; no suspect identified
b20df59db49f234edff9703c3fd056d9fd7c3a7516569e77f421b5adbd909818,2016-11,Durham Constabulary,Durham Constabulary,-1.548886,54.538543,On or near CLOSE STREET,E01012349,Darlington 004A,Investigation complete; no suspect identified
2955a9b541b40b796d65155d11db2cd038b445226d1bbd69c05fdb3aa5c28b0e,2016-11,Durham Constabulary,Durham Constabulary,-1.689794,54.640285,On or near DENT STREET,E01020907,County Durham 058C,Investigation complete; no suspect identified
fb365e2bbf94b8b71a1266c519c5a716b4940b94f5368cb90f7f8555c7416b98,2016-11,Durham Constabulary,Durham Constabulary,-1.556577,54.533305,On or near DRURY STREET,E01012353,Darlington 008B,Investigation complete; no suspect identified
b7288dea40e07a83408ffafe8f4c30c57301476feea3e618f4148ec748e02b25,2016-11,Durham Constabulary,Durham Constabulary,-1.400124,54.820729,On or near STEPHENS ROAD,E01020775,County Durham 018F,Unable to prosecute suspect
929462d947a89431c05af99f25daba25904524eebd60d0815a318092b5f0f2a5,2016-11,Durham Constabulary,Durham Constabulary,-1.834339,54.849632,On or near Supermarket,E01020640,County Durham 010B,Local resolution
b135bbfddec4bb9c3b081a50fd1b0f85638a6e512c36cd261e45f76f01b55b42,2016-11,Durham Constabulary,Durham Constabulary,-1.560635,54.778326,On or near CHURCH LANE,E01020723,County Durham 029C,Investigation complete; no suspect identified
2b6aeaa72ec9e021c4cdf2fa1c86fcc30230e20ce411b9ee71df75037ae46fba,2016-11,Durham Constabulary,Durham Constabulary,-1.560635,54.778326,On or near CHURCH LANE,E01020723,County Durham 029C,Investigation complete; no suspect identified
e7c6be708790ab5f5748e0157dff207853cc61f34529fbeabad86d44c5262696,2016-11,Durham Constabulary,Durham Constabulary,-1.736771,54.710079,On or near RYDAL DRIVE,E01020898,County Durham 045F,Unable to prosecute suspect
8976e353946976b9704d53d746b841a0d70c3caed342c186adbcfe586e070d76,2016-11,Durham Constabulary,Durham Constabulary,-1.404838,54.720183,On or near WINGATE ROAD,E01020792,County Durham 040E,Unable to prosecute suspect
c9c022da530a73feb9807a57d9fe52eecd0b64971b0a1ed432326333d60c4540,2016-11,Durham Constabulary,Durham Constabulary,-1.568366,54.621464,On or near Supermarket,E01020831,County Durham 062B,Suspect charged
c9c022da530a73feb9807a57d9fe52eecd0b64971b0a1ed432326333d60c4540,2016-11,Durham Constabulary,Durham Constabulary,-1.568366,54.621464,On or near Supermarket,E01020831,County Durham 062B,Suspect charged
f29852cb9bf39d73706181c68068afb1fbd546cc37e018d8fc9ed45cba0fc198,2016-11,Durham Constabulary,Durham Constabulary,-1.334365,54.758460,On or near Shopping Area,E01020746,County Durham 037A,Suspect charged
1757bc391a137fb70d15657979c2b177d7293e4d6da6ea2615a9072cb5988bb8,2016-11,Durham Constabulary,Durham Constabulary,-1.568366,54.621464,On or near Supermarket,E01020831,County Durham 062B,Suspect charged
1757bc391a137fb70d15657979c2b177d7293e4d6da6ea2615a9072cb5988bb8,2016-11,Durham Constabulary,Durham Constabulary,-1.568366,54.621464,On or near Supermarket,E01020831,County Durham 062B,Suspect charged
b5079cb76a7e40161ce68332dcd255e04d94060242d3b9110aa008add247d67d,2016-11,Durham Constabulary,Durham Constabulary,-1.551446,54.524937,On or near STONEBRIDGE,E01033484,Darlington 008F,Offender given penalty notice
0b73371774d3932235fb9a0de821576cc3f1d13a9cafa4bdf29e5204485258f7,2016-11,Durham Constabulary,Durham Constabulary,-1.313326,54.762054,On or near SIXTH STREET,E01020767,County Durham 036C,Investigation complete; no suspect identified
c5b97d350f5c317b4e391ede7fdc0a670f145d510a6e7bec9533451be172def7,2016-11,Durham Constabulary,Durham Constabulary,-1.542406,54.523654,On or near PEEL STREET,E01012304,Darlington 012A,Investigation complete; no suspect identified
7fc21894af196f06b2896371a9ebe6f14dd1d042b671aaa8abe2f235e73d1f92,2016-11,Durham Constabulary,Durham Constabulary,-1.554851,54.554184,On or near FALMOUTH DRIVE,E01032546,Darlington 002F,Unable to prosecute suspect
8fe9854cadd731f23b23be70ccd7f059d60a138256504210e9c0d1f233f19d7c,2016-11,Durham Constabulary,Durham Constabulary,-1.560843,54.688685,On or near DAVY STREET,E01020807,County Durham 049B,Offender given a caution
1519676db110d943ec31ed360da6dffe8fc38461466d91e5300e2d497b7c8417,2016-11,Durham Constabulary,Durham Constabulary,-1.599536,54.877141,On or near CONWAY PLACE,E01020615,County Durham 005B,Investigation complete; no suspect identified
3d41268dfb0a719295476dd77628b4b3645863cee14f18e74876c4c932bb17cf,2016-11,Durham Constabulary,Durham Constabulary,-1.560843,54.688685,On or near DAVY STREET,E01020807,County Durham 049B,Offender given a caution
514b34744499395642e943e3c1f33692b0f38cbaa0da9dd3267bb9e2a380630f,2016-11,Durham Constabulary,Durham Constabulary,-1.705504,54.859093,On or near MAPLE STREET,E01020672,County Durham 009E,Investigation complete; no suspect identified
f599b5972ccefeda6ebd5238659b665e194c7a09c69e29f774d1c84a9fadd4e1,2016-11,Durham Constabulary,Durham Constabulary,-1.556359,54.537753,On or near WHESSOE ROAD,E01012349,Darlington 004A,Unable to prosecute suspect
d71cf4cd07fcc4a7aab3a67756b8fa276cb7939f09d6fe4e389868a3fd74466b,2016-11,Durham Constabulary,Durham Constabulary,-1.330392,54.761017,On or near KENTMERE PLACE,E01020758,County Durham 032D,Local resolution
a305559d82cb43f1344bcbab7ddc3366f08fc4db649d3c2bcdb89184c0975b76,2016-11,Durham Constabulary,Durham Constabulary,-1.341291,54.754903,On or near ARUN CLOSE,E01020780,County Durham 035F,Investigation complete; no suspect identified
5ec3e21cf237b25731a3de53f19d57492ccabac1ee68a4dca75697ef5138b6d5,2016-11,Durham Constabulary,Durham Constabulary,-1.689112,54.875839,On or near WYLAM ROAD,E01020662,County Durham 004B,Further investigation is not in the public interest
fb42a4f0ea18e1d4f9dba285843eb28f6cb6806aa6e91f386a88975349264622,2016-11,Durham Constabulary,Durham Constabulary,-1.569259,54.614583,On or near SURTEES WALK,E01020826,County Durham 063B,Investigation complete; no suspect identified
dca5ddce4749d47e6a42767d4222d0823b54ad865db68a592b704bb057722bf1,2016-11,Durham Constabulary,Durham Constabulary,-1.296902,54.748435,On or near WELFARE CRESCENT,E01020737,County Durham 039B,Investigation complete; no suspect identified
59048196680e826159e438a90e2fb8e505358eed0a71791b1118cb23e1872540,2016-11,Durham Constabulary,Durham Constabulary,-1.648566,54.647326,On or near JACKSON STREET,E01020880,County Durham 055D,Investigation complete; no suspect identified
2a08dba484257cb8daffc2a68c685f322c552fdde04d0f2a22e717ea2665b386,2016-11,Durham Constabulary,Durham Constabulary,-1.320170,54.785844,On or near STATION ROAD,E01020752,County Durham 025B,Suspect charged
0b2a620a5219a81a150a7dcac0e59e3b32ae2cbaba1e94c721527a4512ffbd7c,2016-11,Durham Constabulary,Durham Constabulary,-1.324623,54.757444,On or near LEAZES RISE,E01020745,County Durham 032A,Unable to prosecute suspect
bbe87f3e237acc04c70f60305228004eff94352ebc6f590a4453185634a3f0f9,2016-11,Durham Constabulary,Durham Constabulary,-1.732872,54.849973,On or near A6076,E01020625,County Durham 009B,Investigation complete; no suspect identified
05a2ecea8c16446b535c4fa3cecc2d1fb8bcbdd350f060ba4bfe8837794a772f,2016-11,Durham Constabulary,Durham Constabulary,-1.606215,54.696955,On or near PRINCESS STREET,E01020835,County Durham 052D,Investigation complete; no suspect identified
3e5d286d3897681c905395cd5d5cfd20cfda7f82abfd5762d746206f12498205,2016-11,Durham Constabulary,Durham Constabulary,-1.549248,54.776127,On or near LAUREL AVENUE,E01020724,County Durham 029D,Investigation complete; no suspect identified
0db9d7dc8d7fba4641c8d344628005dbab1812f7fe7bd27a1759109fc19d232d,2016-11,Durham Constabulary,Durham Constabulary,-1.767560,54.648134,On or near TOFT HILL LANE,E01020858,County Durham 064B,Investigation complete; no suspect identified
bb61d9f5e1f03f025e6b801f0c853d56f22702acc232e8fe6d0f7f9407bebcca,2016-11,Durham Constabulary,Durham Constabulary,-1.521465,54.549348,On or near ABERDEEN ROAD,E01012328,Darlington 003A,Investigation complete; no suspect identified
547bdbcb303ca52ed497b8c09802ee650673f2d1aea14a9cac77425298b456e9,2016-11,Durham Constabulary,Durham Constabulary,-1.738932,54.905234,On or near MAPLE TERRACE,E01020636,County Durham 001C,Investigation complete; no suspect identified
fcaf7eeca8ccb616e494ac22482fc961d71c12950f3f038456b0c8e8db8fb09b,2016-11,Durham Constabulary,Durham Constabulary,-1.533948,54.544633,On or near OTTERBURN CLOSE,E01012332,Darlington 005C,Suspect charged
110879da872115f16981bab57ef591b359efe492ecd52f83fa8d32da5d03b62a,2016-11,Durham Constabulary,Durham Constabulary,-1.680314,54.655817,On or near Hospital,E01020872,County Durham 056C,Suspect charged
ef5efb75f07eec41e5e94627bec7182dd9f1d260f8d1db8143a5ab2916a611a0,2016-11,Durham Constabulary,Durham Constabulary,-1.556002,54.532188,On or near WILKES STREET,E01012354,Darlington 008C,Unable to prosecute suspect
368eac8cdb83359c6d0936dc4acd76777e1479b0ef5b732442c0f7c858627345,2016-11,Durham Constabulary,Durham Constabulary,-1.721667,54.862214,On or near SANDGATE,E01020624,County Durham 009A,Investigation complete; no suspect identified
b6f480251ee2a1c2694a210cfa635207f7e10d966d8aab273cd3fdcd476f385c,2016-11,Durham Constabulary,Durham Constabulary,-1.331697,54.834607,On or near LINTHORPE ROAD,E01020784,County Durham 017F,Investigation complete; no suspect identified
280f646aba01d4ea0029411fb450b5164dcdd8e25f31cc3a28699b4c5cb92fac,2016-11,Durham Constabulary,Durham Constabulary,-1.351345,54.834561,On or near LAUREL AVENUE,E01020749,County Durham 018D,Investigation complete; no suspect identified
4bfac036084aa1b30c2ae042db5629e3536062d2cb8759dbb9abc0a74510bb5c,2016-11,Durham Constabulary,Durham Constabulary,-1.581386,54.529754,On or near PENNINE CLOSE,E01012347,Darlington 011C,Investigation complete; no suspect identified
d5c2d5a86f91c167868a40b400b007d213571be1851194a29eb8761b2b0dc349,2016-11,Durham Constabulary,Durham Constabulary,-1.634565,54.872623,On or near POPLAR STREET,E01020622,County Durham 002C,Unable to prosecute suspect
d1068ae4b66d358d9400e626566f8933096907601644c2c9df5fe95d4207bfac,2016-11,Durham Constabulary,Durham Constabulary,-1.525344,54.786263,On or near Shopping Area,E01020683,County Durham 028B,Suspect charged
6f0582f6ce42a3e3be8479150e9dc6d8b4f7ef19060f617633e6931bd8c173b8,2016-11,Durham Constabulary,Durham Constabulary,-1.581507,54.702148,On or near THE SPINNEY,E01020842,County Durham 049D,Unable to prosecute suspect
db1f92c7975fde597ff14dfe582145d28246719c606b086ddca75e2dd37252cd,2016-11,Durham Constabulary,Durham Constabulary,-1.599567,54.700771,On or near HOLBORN,E01020820,County Durham 049C,Investigation complete; no suspect identified
0a6f736763b059ae73c2d15ea2c1ae61eca5ba69df5931039d1a0c9d9b19037c,2016-11,Durham Constabulary,Durham Constabulary,-1.868914,54.839672,On or near RUTLAND ROAD,E01020645,County Durham 014E,Offender given a drugs possession warning
c30c1efefd7d92bba183b392348ce36f41e84813b8424b613a138f65565a390e,2016-11,Durham Constabulary,Durham Constabulary,-1.552673,54.537065,On or near NORTH ROAD,E01012349,Darlington 004A,Investigation complete; no suspect identified
80f5e81a8ded407a9c2119bbefcd9548b5934a9c4b86bda734f89f287a9acf40,2016-11,Durham Constabulary,Durham Constabulary,-1.593633,54.617543,On or near ESKDALE PLACE,E01020816,County Durham 061A,Investigation complete; no suspect identified
367d2e4863a44b3e35fe62548782c24bd1c5c65ebbea6db78e689466845dc798,2016-11,Durham Constabulary,Durham Constabulary,-1.593633,54.617543,On or near ESKDALE PLACE,E01020816,County Durham 061A,Investigation complete; no suspect identified
043970bec15965174bb2d833b3bc464a77bb56de562c3f1d41a587537417616e,2016-11,Durham Constabulary,Durham Constabulary,-1.335335,54.764720,On or near ADFRID PLACE,E01020757,County Durham 032C,Investigation complete; no suspect identified
19838a75a260e3eca1aa5d93fbbc74fd4f69fa0eb99a1bade185d8971f3a8b8e,2016-11,Durham Constabulary,Durham Constabulary,-1.927505,54.542714,On or near BRIDGEGATE,E01020854,County Durham 066C,Investigation complete; no suspect identified
b8e79e22a4337ff9e6ddd5c212dcc7abee6b97de64de11383448cd8928216e63,2016-11,Durham Constabulary,Durham Constabulary,-1.551094,54.552813,On or near KETTON AVENUE,E01032546,Darlington 002F,Suspect charged
25a1adc72939d9d4e9267a1487283051428a37fe52c84a12f254f4bce3457840,2016-11,Durham Constabulary,Durham Constabulary,-1.551842,54.531050,On or near WOOLER STREET,E01033483,Darlington 008E,Investigation complete; no suspect identified
2ac52a38280ac21dceb4f5d3bfde6ae6c5ed0080d6ad9aa3bf7fb7e811e35546,2016-11,Durham Constabulary,Durham Constabulary,-1.601538,54.884363,On or near ARISAIG,E01020614,County Durham 002B,Unable to prosecute suspect
743ed4d72a5fb3964d582d102a1cf0271e266c4138e572b1403ba691f41b84ec,2016-11,Durham Constabulary,Durham Constabulary,-1.738351,54.862502,On or near FINES PARK,E01020626,County Durham 006A,Investigation complete; no suspect identified
cfd32e2bdce9e6ae995015c7b49e4b82d34f950b70cd5ac189485743db75fece,2016-11,Durham Constabulary,Durham Constabulary,-1.704760,54.860664,On or near MUNDELL STREET,E01020671,County Durham 009D,Local resolution
6e8b9ec3113825a22b58b98732ed3f0782365c9d40b0bf1514212865383e79f9,2016-11,Durham Constabulary,Durham Constabulary,-1.707620,54.634929,On or near OLD HALL FARM ROAD,E01020897,County Durham 057E,Offender given a drugs possession warning
e47b2710028322d55514b8b93da65b3590a0af4f3a3e7ba86b6119865ffa2941,2016-11,Durham Constabulary,Durham Constabulary,-1.565182,54.623717,On or near BELLASIS CLOSE,E01020831,County Durham 062B,Unable to prosecute suspect
6d1a464125b5eb0a7b9a9f68b82bbe4467e8f2924b46bac0c3cece936d05afa0,2016-11,Durham Constabulary,Durham Constabulary,-1.690844,54.640764,On or near BODDY STREET,E01020907,County Durham 058C,Local resolution
f5079739007f79a754a25742a1fe74bd0d9ad56037f106a56809a39b5ffcb165,2016-11,Durham Constabulary,Durham Constabulary,-1.332664,54.760778,On or near SURTEES ROAD,E01020758,County Durham 032D,Investigation complete; no suspect identified
e2658d8a5004587d63beddd6457838315cf6697105cdfe1610c3843f99aeb899,2016-11,Durham Constabulary,Durham Constabulary,-1.357916,54.753994,On or near PENTLAND CLOSE,E01020769,County Durham 037B,Investigation complete; no suspect identified
7572854b31f8721b66d26536879c147e6a0b21081d29b6f74be4e80e68382c0b,2016-11,Durham Constabulary,Durham Constabulary,-1.346002,54.749887,On or near Park/Open Space,E01020777,County Durham 037C,Investigation complete; no suspect identified
ed92d308f6ef9cfed423cb9ac25c0161744ac526f68dd28e28e287cf4c9274cd,2016-11,Durham Constabulary,Durham Constabulary,-1.542727,54.688474,On or near Supermarket,E01020798,County Durham 050B,Investigation complete; no suspect identified
1d07788a3f27c7f94bc8bb28d57314861fdf429ccef540ef2ffe92184b703e72,2016-11,Durham Constabulary,Durham Constabulary,-1.746818,54.863698,On or near SWAN STREET,E01020639,County Durham 006C,Investigation complete; no suspect identified
f5b8f1dac9f170b4e472b1d7638608e8f62e5365d951a84c22f008023bb7daa9,2016-11,Durham Constabulary,Durham Constabulary,-1.873407,54.797036,On or near WEATHERLEYHILL LANE,E01020664,County Durham 020B,Investigation complete; no suspect identified
8465c1b26b44eb9aaf465e129b5263e3295564952998519a5a22e61cc3f52bf3,2016-11,Durham Constabulary,Durham Constabulary,-1.670461,54.659034,On or near QUEEN'S ROAD,E01020868,County Durham 055A,Suspect charged
b57f9cf0c0f37cd40f82626afb42a8612d5409544fd38c818c015d3ed52988b3,2016-11,Durham Constabulary,Durham Constabulary,-1.371624,54.721579,On or near CHURCH STREET,E01020795,County Durham 043D,Investigation complete; no suspect identified
86ecd092e34f1711ebb33c70e2fa51ba5f97ae0678c24c2d0745a74c3009457d,2016-11,Durham Constabulary,Durham Constabulary,-1.357916,54.753994,On or near PENTLAND CLOSE,E01020769,County Durham 037B,Investigation complete; no suspect identified
1873800dd3e3f4789fe72febb71ec5ff8a62b10c0b753613d9953e49e76ea64f,2016-11,Durham Constabulary,Durham Constabulary,-1.569130,54.880092,On or near VIGO LANE,E01020611,County Durham 007D,Investigation complete; no suspect identified
06755fa3f2c913c583ed309b8df185e150bc5eb55b008f5210f14185ffabdff0,2016-11,Durham Constabulary,Durham Constabulary,-1.563331,54.518798,On or near HAREWOOD GROVE,E01012360,Darlington 010C,Investigation complete; no suspect identified
f25def80fbe9020da56ab84a23da7493f5bb986c8361e96eaffbd252dcb4629f,2016-11,Durham Constabulary,Durham Constabulary,-1.561998,54.522100,On or near WESTCLIFFE COURT,E01012356,Darlington 014A,Unable to prosecute suspect
48ebc66f10479639968ea07fd19c9e9ae04cd1d3092306f190b073cb391ab51c,2016-11,Durham Constabulary,Durham Constabulary,-1.551842,54.531050,On or near WOOLER STREET,E01033483,Darlington 008E,Investigation complete; no suspect identified
d2d0b760af71295b8a5a7bc25f760273b5b8212c72c377aac8e715bc075db5ef,2016-11,Durham Constabulary,Durham Constabulary,-1.742649,54.821120,On or near FRONT STREET,E01020664,County Durham 020B,Unable to prosecute suspect
3cc07736986acc278da9321414ee0313831f1657d0c76a5e675b0c5aa6d347d4,2016-11,Durham Constabulary,Durham Constabulary,-1.744976,54.864305,On or near THE RIDINGS,E01020639,County Durham 006C,Investigation complete; no suspect identified
2e0daac11d0f3747d5558004fbf3266c0068621195477f9519c8e63c3492ae53,2016-11,Durham Constabulary,Durham Constabulary,-1.539227,54.519212,On or near FALMER ROAD,E01012340,Darlington 012D,Investigation complete; no suspect identified
6d3ede42adc71a428b1314b5c841f04a9b49ce46cb3e4742eb29ac04545feef8,2016-11,Durham Constabulary,Durham Constabulary,-1.558479,54.541805,On or near WHESSOE ROAD,E01012352,Darlington 004D,Investigation complete; no suspect identified
cfcb8e8b639c0dea253fad48195e010aafe094ce23eddbd7f18bc14238baca18,2016-11,Durham Constabulary,Durham Constabulary,-1.760076,54.876809,On or near CO-OPERATIVE TERRACE,E01020654,County Durham 001D,Local resolution
9f2f07ae6ffdc12bb54a24ed7c3ff0ef21957bae2929b4b98b53079e085e6436,2016-11,Durham Constabulary,Durham Constabulary,-1.681705,54.652360,On or near WORDSWORTH AVENUE,E01020871,County Durham 056B,Unable to prosecute suspect
70385b2e6969b6ddf8f570953a2574d2337f4e0c4f238b3fbe99e1fb744ebe78,2016-11,Durham Constabulary,Durham Constabulary,-1.838791,54.850114,On or near PONDS COURT,E01020644,County Durham 014D,Local resolution
67e48d5ad2b75be1b95f5ef2484668bf2c10de47d8b4209979dd4f73d141c821,2016-11,Durham Constabulary,Durham Constabulary,-1.552003,54.541790,On or near ZETLAND STREET,E01012349,Darlington 004A,Unable to prosecute suspect
dc42b2541eeecfa7868eb18112792ce83acd200722154758aa4874dcff51e46d,2016-11,Durham Constabulary,Durham Constabulary,-1.640034,54.644812,On or near CLOSE HOUSE,E01020838,County Durham 059C,Investigation complete; no suspect identified
08da571b31ffb12cd2e95f1e776a9e6b9fd7c248274309fbc57ee7aec479686e,2016-11,Durham Constabulary,Durham Constabulary,-1.345707,54.763374,On or near WESTON VIEW,E01020780,County Durham 035F,Investigation complete; no suspect identified
5c7860dfa03388c841c4a0daf54e29ee63ddcf1c97b95173ddc2a85db57772f1,2016-11,Durham Constabulary,Durham Constabulary,-1.535366,54.530071,On or near ARNOLD ROAD,E01012342,Darlington 009C,Unable to prosecute suspect
de3f92fc84704d4fd48abebf2e153bcfca6449be278d8f3a0fdd490ddd577456,2016-11,Durham Constabulary,Durham Constabulary,-1.319267,54.764595,On or near HAMILTON STREET,E01020766,County Durham 036B,Unable to prosecute suspect
0e44e60db3883332780d003828f984219c96767389c026a3bf97ba7c4b8aa1c3,2016-11,Durham Constabulary,Durham Constabulary,-1.429720,54.750327,On or near ALBERT STREET,E01020789,County Durham 040B,Unable to prosecute suspect
ba795e903957ef9f01185be891b600a6f8293a46c40e649997a44ed8012abac2,2016-11,Durham Constabulary,Durham Constabulary,-1.742649,54.821120,On or near FRONT STREET,E01020664,County Durham 020B,Further investigation is not in the public interest
830a8a4de5ebe7f1ed007127a7e62dd1dc9145b1839d4a3e343e22526c7f5c96,2016-11,Durham Constabulary,Durham Constabulary,-1.688437,54.872414,On or near Petrol Station,E01020662,County Durham 004B,Investigation complete; no suspect identified
86cb717bc29cbc80b5acc183e05722c188fd44a4c1347eda0fcb1b3b4008cf29,2016-11,Durham Constabulary,Durham Constabulary,-1.429720,54.750327,On or near ALBERT STREET,E01020789,County Durham 040B,Unable to prosecute suspect
cfc2c454fa78f09bc784c46a30d5906f0ee2819c994cc949a9ed3270853046cb,2016-11,Durham Constabulary,Durham Constabulary,-1.377830,54.724918,On or near JOHNSON'S STREET,E01020795,County Durham 043D,Investigation complete; no suspect identified
86ece14eb2674969cabddbbdd5081995eee676ccb99486daa42ac5a286db7d7c,2016-11,Durham Constabulary,Durham Constabulary,-1.774837,54.792374,On or near CORNSAY LANE,E01020646,County Durham 024A,Investigation complete; no suspect identified
f434670d5b727884b4f930aa311e47416b12c11024e28c66ed34a82dca48b761,2016-11,Durham Constabulary,Durham Constabulary,-1.602775,54.698059,On or near JAMES STREET,E01020836,County Durham 052E,Investigation complete; no suspect identified
64564dae86faa13f2ed8c15d5ebf0ffd4a00f85ad51663860b073a0519bf6052,2016-11,Durham Constabulary,Durham Constabulary,-1.555164,54.526811,On or near Supermarket,E01033484,Darlington 008F,Suspect charged
