Crime ID,Month,Reported by,Falls within,Longitude,Latitude,Location,LSOA code,LSOA name,Outcome type
b903d5e7a5467a0bf594d81eeb428f302d4764c4f5819bb27e44eeea4b8af640,2019-09,Wiltshire Police,Wiltshire Police,-2.231303,51.312667,On or near SANDFORD PARK,E01032096,Wiltshire 033A,Unable to prosecute suspect
26842f5dc750013fc324be25791918c5b2500681515af8819db96be9c6df3c7e,2019-09,Wiltshire Police,Wiltshire Police,-1.774357,51.337954,On or near BROADFIELDS,E01031869,Wiltshire 024B,Investigation complete; no suspect identified
e46358a983faaa65d5367d6a6325e3628a83765748a095d10dc0f9a072dc6125,2019-09,Wiltshire Police,Wiltshire Police,-1.781937,51.594794,On or near HILMARTON AVENUE,E01015545,Swindon 003C,Unable to prosecute suspect
a8dc5d85ce3bfb85790d44a06257113e39da643d1796d5ae32577f3d2d3e2eb3,2019-09,Wiltshire Police,Wiltshire Police,-1.885855,51.586372,On or near RESTROP VIEW,E01031955,Wiltshire 003B,Unable to prosecute suspect
3db438d566178183a121951778e4a4f7c6f72043c4fd3286622d9d4010df1fa8,2019-09,Wiltshire Police,Wiltshire Police,-1.758027,51.385911,On or near Park/Open Space,E01031868,Wiltshire 012B,Investigation complete; no suspect identified
852026642c2f85ba1a9ab7c495b9265f0a35ef3844e1be31a46c273b5861232a,2019-09,Wiltshire Police,Wiltshire Police,-1.997395,51.353403,On or near NORTHGATE STREET,E01031854,Wiltshire 026B,Unable to prosecute suspect
24b431b4b276c6873ac12c10a16235d9447860479de081a5998ad975edc73f83,2019-09,Wiltshire Police,Wiltshire Police,-1.830263,51.086590,On or near CEDAR CLOSE,E01031980,Wiltshire 052A,Investigation complete; no suspect identified
ba553821a0ba3f00042e3d0504485c679b9fd3b29cad42f048f834c5daa72d3f,2019-09,Wiltshire Police,Wiltshire Police,-1.688903,51.479485,On or near COPSE DROVE,E01031841,Wiltshire 012A,Investigation complete; no suspect identified
73e09aeb9349d0cf3886b0660531f8f29ffa322b076e5e1e56e4861379585c63,2019-09,Wiltshire Police,Wiltshire Police,-2.149689,51.196508,On or near BOREHAM ROAD,E01032082,Wiltshire 047E,Investigation complete; no suspect identified
d38a54873ce6f6ac9b85351a38f46ed05f08d920533b14dc84ee658bd1657944,2019-09,Wiltshire Police,Wiltshire Police,-1.708450,51.374477,On or near FOREST ROAD,E01031866,Wiltshire 024A,Investigation complete; no suspect identified
e4dec163ea9377ceeec1dbb40528cbc1b27dfbeff7b96e97e03f5f37416c875c,2019-09,Wiltshire Police,Wiltshire Police,-1.769408,51.568884,On or near Petrol Station,E01015479,Swindon 017A,Suspect charged
8dc693269f5df3f8fe5a9d29aae3143006f7c5c469f3b6796c3b6ed0fece3347,2019-09,Wiltshire Police,Wiltshire Police,-2.155393,51.198964,On or near ST GEORGES CLOSE,E01032104,Wiltshire 042A,Investigation complete; no suspect identified
492653719fec55c1629077fe22a372400a070c8cfa5f786b84fc0a29a6b0c7c7,2019-09,Wiltshire Police,Wiltshire Police,-1.780064,51.203942,On or near HACKTHORNE ROAD,E01031999,Wiltshire 046D,Investigation complete; no suspect identified
e82b2798ea9065babf6b60486c0d443fe5e2483007488ecd59e9c6b6b9570ac2,2019-09,Wiltshire Police,Wiltshire Police,-1.790398,51.068235,On or near CULVER STREET,E01032022,Wiltshire 058C,Unable to prosecute suspect
125ad6f965e4287b1ccf8ae57c01e28b9b0249af799adb2083daf79c8fb1b283,2019-09,Wiltshire Police,Wiltshire Police,-2.247594,51.415103,On or near HAZELBURY HILL,E01031890,Wiltshire 017C,Unable to prosecute suspect
d1a07bdd4fa7fcaf5bcf462a65c6d71ec7260c8fcfdae92db17e363da28c546c,2019-09,Wiltshire Police,Wiltshire Police,-2.128140,51.383014,On or near BOWDEN CRESCENT,E01032064,Wiltshire 020B,Investigation complete; no suspect identified
2192c0099e30d9019e9b030a79b1cd411a49bdeea15ffd681d0869ea9da1b882,2019-09,Wiltshire Police,Wiltshire Police,-2.135112,51.461593,On or near NEELD CRESCENT,E01031925,Wiltshire 010E,Further investigation is not in the public interest
dbb313052fce2a86708bea02ad8535d6f6885ffb03522ff34d2ec02badfad5b1,2019-09,Wiltshire Police,Wiltshire Police,-2.143123,51.381576,On or near BEANACRE ROAD,E01032063,Wiltshire 020A,Investigation complete; no suspect identified
a079f92f448df219d26c9d11a6756eae3407a936d1aa57d51fd2aa58e1d20319,2019-09,Wiltshire Police,Wiltshire Police,-2.001832,51.355004,On or near BELLE VUE ROAD,E01031853,Wiltshire 026A,Investigation complete; no suspect identified
652977410b9aa147252a2b1f567c85e6b84ba9701b2c9a4c01463f50fdb790ae,2019-09,Wiltshire Police,Wiltshire Police,-1.826419,51.605064,On or near TWINEHAM ROAD,E01032713,Swindon 026F,Suspect charged
b149d0d67f559aa5ec68027b023293cf95e0e2449751f48047856133e39871d5,2019-09,Wiltshire Police,Wiltshire Police,-1.730057,51.547859,On or near Supermarket,E01015488,Swindon 023B,Investigation complete; no suspect identified
84976d756cd554223ccce176baab48588b2271126ecaaf404e9b6108deee0404,2019-09,Wiltshire Police,Wiltshire Police,-1.745783,51.562217,On or near MARLOWE AVENUE,E01015538,Swindon 016A,Investigation complete; no suspect identified
857f3b5300abb290dc6643310d6d07405cf96abd40e2a5e704cca501697a785c,2019-09,Wiltshire Police,Wiltshire Police,-1.812759,51.615806,On or near Park/Open Space,E01015474,Swindon 008B,Investigation complete; no suspect identified
14f5e4b24913179fa36f569aefc899d30b8de93c82f347f1d9151812a0cd7de8,2019-09,Wiltshire Police,Wiltshire Police,-2.259930,51.470464,On or near A420,E01031950,Wiltshire 008C,Investigation complete; no suspect identified
e954fde5c4e55b7876ad91b48a4caaf3cf7c232c9e1e1d8b07f3271149782deb,2019-09,Wiltshire Police,Wiltshire Police,-1.778472,51.574071,On or near TIVERTON ROAD,E01015508,Swindon 010A,Investigation complete; no suspect identified
4dcefa6316b185f1e95205a996f16edfcd5ac2369a3f1f729e3fc72272de4552,2019-09,Wiltshire Police,Wiltshire Police,-1.836069,51.579938,On or near BOTLEY COPSE,E01015562,Swindon 011A,Suspect charged
a137f31d62fa36cbbd80dd1408a296195987464464758950c3df08cc3c2cc04a,2019-09,Wiltshire Police,Wiltshire Police,-1.785196,51.561954,On or near Shopping Area,E01015476,Swindon 015B,Investigation complete; no suspect identified
a60bb150961a6be0dfd2c8bc37aa794653b1cef779d76af1c5c2b096665967c3,2019-09,Wiltshire Police,Wiltshire Police,-1.797148,51.569960,On or near HARCOURT ROAD,E01015578,Swindon 012B,Unable to prosecute suspect
084555355bfe77b0c78dfb6959c116cfa6f2039b07b5d88443920c2f6d47d34e,2019-09,Wiltshire Police,Wiltshire Police,-1.786161,51.525325,On or near Hospital,E01015585,Swindon 025C,Investigation complete; no suspect identified
2514cb0c92d6eca154d35e7cab4fdb3d5dc66c13a4bbaeec04f65b6de2dfd9af,2019-09,Wiltshire Police,Wiltshire Police,-1.712401,51.628694,On or near THE GREEN,E01015520,Swindon 001B,Investigation complete; no suspect identified
f2ca24acbf84ca688dcb2f28e81f2489456ae4863ba656d323e57dadfb442387,2019-09,Wiltshire Police,Wiltshire Police,-2.152417,51.462723,On or near FROGWELL,E01031940,Wiltshire 008B,Unable to prosecute suspect
5722475aa77736803a9ad4ec99f9a814969e91bf8c4ab8ce2ea84e883eafd0b2,2019-09,Wiltshire Police,Wiltshire Police,-2.114952,51.458530,On or near CHAPEL LANE,E01031912,Wiltshire 011B,Unable to prosecute suspect
8305613053c6282d5876111843466fae908ec959c0f89304f46a673536cb247f,2019-09,Wiltshire Police,Wiltshire Police,-1.804307,51.582821,On or near LEWISHAM CLOSE,E01015530,Swindon 006D,Unable to prosecute suspect
fd096043fbb6e34d00c8bdc62f3bd19c8c9e91282fe0a370afdfb2f75bde79a4,2019-09,Wiltshire Police,Wiltshire Police,-1.725815,51.586764,On or near ASH GARDENS,E01015473,Swindon 008A,Unable to prosecute suspect
a419933aff045c6223a685e13a67775b0283fd63e100fe29282dd57595443601,2019-09,Wiltshire Police,Wiltshire Police,-1.997668,51.346866,On or near CORNWELL CRESCENT,E01031856,Wiltshire 026D,Investigation complete; no suspect identified
03b9fd0599dc7f23a275239ec630dd39b8f603b9af515fcaefe4dc36963a36ec,2019-09,Wiltshire Police,Wiltshire Police,-1.775934,51.591501,On or near CHARLTON CLOSE,E01015544,Swindon 003B,Unable to prosecute suspect
23342bbbedf426c833472ca830ab79c49be195d56eaed49721c96ee52d456c2c,2019-09,Wiltshire Police,Wiltshire Police,-1.992556,51.351479,On or near RENDELLS COURT,E01031856,Wiltshire 026D,Unable to prosecute suspect
812430c14bb87f66d461055e3618800dd0bd796ab7f356da065a472772cb9c10,2019-09,Wiltshire Police,Wiltshire Police,-2.114952,51.458530,On or near CHAPEL LANE,E01031912,Wiltshire 011B,Unable to prosecute suspect
bd1e834980d4e86a0902eaa777ed36caf35438ae607d43c3230f9d4c2dfbe5d9,2019-09,Wiltshire Police,Wiltshire Police,-1.791353,51.074738,On or near QUEENS ROAD,E01032016,Wiltshire 056C,Suspect charged
cf9397a3e651d313f5ee053091076aea10955a48763481af4cc0fe5d1c93af07,2019-09,Wiltshire Police,Wiltshire Police,-2.203828,51.322492,On or near Parking Area,E01032101,Wiltshire 032C,Investigation complete; no suspect identified
2902113dd4e281a34a49ebc4ead39a77da9123687807aba2aa1b27fbfbb4b4cd,2019-09,Wiltshire Police,Wiltshire Police,-1.806056,51.544979,On or near MILL LANE,E01015585,Swindon 025C,Investigation complete; no suspect identified
e9f7c1f37f4fd1b83b9760872ea1a5a75a8444fa5d1419eb0b2258102b1a96fc,2019-09,Wiltshire Police,Wiltshire Police,-1.798875,51.554669,On or near A3102,E01015478,Swindon 021A,Suspect charged
523f3a957a3e73d4dc465be0b09368697523fe64bfc02845582f8b008c5336e4,2019-09,Wiltshire Police,Wiltshire Police,-1.782751,51.551286,On or near PENFOLD GARDENS,E01015532,Swindon 021D,Unable to prosecute suspect
026895dd6c6b806b662022f80553cf83d64a40a5775e709b767b5e9cdde2ce3d,2019-09,Wiltshire Police,Wiltshire Police,-1.795525,51.067489,On or near Shopping Area,E01032022,Wiltshire 058C,Investigation complete; no suspect identified
a67c67f7a86cf2c8652072e19a0016aa84a29d51cb612ac8418270decd472250,2019-09,Wiltshire Police,Wiltshire Police,-2.175438,51.204745,On or near COTTON HOUSE GARDENS,E01032103,Wiltshire 044A,Investigation complete; no suspect identified
373886a4ad5ef1ce8b811d0307ea52bd23d719a24e0aaaaf845223dccfe49e27,2019-09,Wiltshire Police,Wiltshire Police,-2.179885,51.320769,On or near CASTELL CLOSE,E01032099,Wiltshire 032A,Investigation complete; no suspect identified
5084dfa3dafafa81d4851d24713b86953ce819ac79a61e20b41a3a3d659177f1,2019-09,Wiltshire Police,Wiltshire Police,-1.811589,51.591491,On or near MELLOW GROUND,E01015513,Swindon 004A,Unable to prosecute suspect
c1ea328706e6197dedbd12229fa5995c521292b26bc5120cf6cd6071b5105b76,2019-09,Wiltshire Police,Wiltshire Police,-2.160499,51.202087,On or near PRINCESS GARDENS,E01032104,Wiltshire 042A,Suspect charged
114c776b02ee7f5a58230741486d19146e6b6f11e49cc194e9723766643e2b20,2019-09,Wiltshire Police,Wiltshire Police,-1.774626,51.569964,On or near CAULFIELD ROAD,E01015510,Swindon 010C,Investigation complete; no suspect identified
b0e472188ec18937903ff6d240ef409187ec8f029987a5df7c2ebcc074035dd4,2019-09,Wiltshire Police,Wiltshire Police,-2.202896,51.277130,On or near Nightclub,E01032056,Wiltshire 039D,Investigation complete; no suspect identified
5b62326c3e12aa2391dffca9a5f29485638b2a2943a5ab0666c1828c4d06f2a4,2019-09,Wiltshire Police,Wiltshire Police,-2.191223,51.431420,On or near ERNESTON CRESCENT,E01031931,Wiltshire 018A,Unable to prosecute suspect
e08d31fe199c97f955f23d1747c670131f7141e7e0f7ea2ec1a1aa6dbc6f707f,2019-09,Wiltshire Police,Wiltshire Police,-1.763168,51.163292,On or near POUNCETTE CLOSE,E01031976,Wiltshire 048C,Unable to prosecute suspect
3d6857eb1d7f9d3e41bfbb05288423316a2136423934717727c79b1d2c4da765,2019-09,Wiltshire Police,Wiltshire Police,-1.983472,51.496746,On or near VICTORIA CLOSE,E01031937,Wiltshire 013C,Offender given penalty notice
058cbbf211d943aace9c9983163024be0a4f238238d3f0560b2ea3f8ef70d5a7,2019-09,Wiltshire Police,Wiltshire Police,-2.210458,51.322570,On or near CONIGRE,E01032086,Wiltshire 031B,Investigation complete; no suspect identified
fe7a749240d6165fd73f8d3f394abafcf056a94e6893e4d8e8b846303d3d7249,2019-09,Wiltshire Police,Wiltshire Police,-2.316804,51.084017,On or near ZEALS RISE,E01032035,Wiltshire 050B,Investigation complete; no suspect identified
0de66f59e299e94e5ac1d8d42958b5c8bdce3971b509610ef7ed44cd5ec1131a,2019-09,Wiltshire Police,Wiltshire Police,-1.773891,51.196053,On or near ANNE CRESCENT,E01031996,Wiltshire 046B,Unable to prosecute suspect
89d21373b510a8098d3ab2a2ed2004ff44ae8c5a5ba61694ec31e163847aec1a,2019-09,Wiltshire Police,Wiltshire Police,-1.791974,51.559251,On or near MAXWELL STREET,E01015476,Swindon 015B,Investigation complete; no suspect identified
aaa06c3d37ec5cbd96b1fbf18b575ce780653d898b6deec7b9bac24738b1821a,2019-09,Wiltshire Police,Wiltshire Police,-2.251912,51.337432,On or near SPENCERS ORCHARD,E01032049,Wiltshire 027E,Investigation complete; no suspect identified
3851db513e98f4ce522f4b6007e9b7e8a46773c1286d2cd993ba5e807b820608,2019-09,Wiltshire Police,Wiltshire Police,-2.205304,51.322084,On or near BREWERY WALK,E01032101,Wiltshire 032C,Investigation complete; no suspect identified
1d2bea81f291db261d973835d81666a36ad6861d042b4b61b2c33620513f4a3b,2019-09,Wiltshire Police,Wiltshire Police,-1.619971,51.255568,On or near RAWLINGS COURT,E01031859,Wiltshire 041A,Unable to prosecute suspect
33415a3e0e6f90c04abcee0583820d05d85d751a440fde63272bc013c06ada6f,2019-09,Wiltshire Police,Wiltshire Police,-1.789993,51.560309,On or near MILTON ROAD,E01015476,Swindon 015B,Investigation complete; no suspect identified
083d9d3a281ed4cc513cef91d7185fe87d2f9348016217d58272cafa818df7e3,2019-09,Wiltshire Police,Wiltshire Police,-1.582296,51.391738,On or near HIGH STREET,E01031843,Wiltshire 029A,Unable to prosecute suspect
31eaf32914c0fb3080feb8e86ec211b8bbe48386bbe66440e69acf5113cf6500,2019-09,Wiltshire Police,Wiltshire Police,-2.209009,51.303618,On or near Shopping Area,E01032092,Wiltshire 035A,Investigation complete; no suspect identified
a845472fce9684ae86213a12ac0fe376d2c7d55b9605de12c7179def3a88e2f3,2019-09,Wiltshire Police,Wiltshire Police,-1.814140,51.581650,On or near Parking Area,E01015581,Swindon 012D,Investigation complete; no suspect identified
9b5c10db05d1400eba44981c101ffef6206b5be624cd2197ff7c5d908717de26,2019-09,Wiltshire Police,Wiltshire Police,-1.839746,51.552034,On or near KIMBOLTON CLOSE,E01015500,Swindon 018B,Unable to prosecute suspect
c0c5b707b10e536350d9cc776512215495ed8dc8b1e83fee7a80b980b8cb6103,2019-09,Wiltshire Police,Wiltshire Police,-2.180147,51.204693,On or near MARKET PLACE,E01032103,Wiltshire 044A,Investigation complete; no suspect identified
743483333772aa6d8d5d151ac9d6defbbcd35957bab6ccf9bed9b4b1036e2fec,2019-09,Wiltshire Police,Wiltshire Police,-2.138826,51.367150,On or near LEWINGTON CLOSE,E01032067,Wiltshire 022C,Action to be taken by another organisation
ed1d77f440e5ae64eaf862668a1b88e3a601a76543cef5ac2ab7002e42aacf7f,2019-09,Wiltshire Police,Wiltshire Police,-1.754838,51.587206,On or near BRIERY CLOSE,E01015552,Swindon 009D,Unable to prosecute suspect
19f1c7a4c02d3bc1b35f504851f4aef45f982c1096026c10c3ae29b66b4d427c,2019-09,Wiltshire Police,Wiltshire Police,-1.989224,51.352782,On or near Supermarket,E01031850,Wiltshire 025A,Unable to prosecute suspect
5e6b679f9a95338abe65b6bf3b36b1b4da9e28d2f460e6fbd62f945ff3509e85,2019-09,Wiltshire Police,Wiltshire Police,-1.776077,51.090248,On or near LINDFORD ROAD,E01031984,Wiltshire 051A,Unable to prosecute suspect
59a794445de667d45f63aa257167fba7ccf07f79497fcafc676a5413d54bc5d7,2019-09,Wiltshire Police,Wiltshire Police,-1.796752,51.070737,On or near Supermarket,E01032014,Wiltshire 056A,Investigation complete; no suspect identified
ffdf56a5ba563bf782c3fe5aead0570f1be2693c298d64e6abee0184a6167462,2019-09,Wiltshire Police,Wiltshire Police,-1.898324,51.548260,On or near FAIRFIELD,E01031963,Wiltshire 006A,Investigation complete; no suspect identified
d41bc09d69a859adfd25184942dcc9a540938bb2c5f39f68b9075665e9d52d80,2019-09,Wiltshire Police,Wiltshire Police,-1.791449,51.557290,On or near CAMBRIA BRIDGE ROAD,E01015494,Swindon 019A,Unable to prosecute suspect
5deaa9e0ce210dc472f40cd031ce3e2914dc546c2e9d2db1d91f79fb8e97dd76,2019-09,Wiltshire Police,Wiltshire Police,-2.184639,51.336281,On or near GREENHILL GARDENS,E01032079,Wiltshire 030C,Investigation complete; no suspect identified
ab06fa4a4043145f55108c931e243c5584e38179a121ba7ae3aeaf7b86abc45d,2019-09,Wiltshire Police,Wiltshire Police,-2.169694,51.199754,On or near CANONS CLOSE,E01032105,Wiltshire 042B,Unable to prosecute suspect
ceeeb6f08e37fa05c465fd693fca57180e62c795f6d0523f715d1537f4b8a3bc,2019-09,Wiltshire Police,Wiltshire Police,-2.274771,51.187100,On or near Park/Open Space,E01032081,Wiltshire 047D,Unable to prosecute suspect
2df431a70a5913fe2b1fce361c2d0b4b22a8a39bf67e07989438d86034d2b04a,2019-09,Wiltshire Police,Wiltshire Police,-1.751384,51.558939,On or near KINGSWOOD AVENUE,E01015538,Swindon 016A,Investigation complete; no suspect identified
d3a217a18594874a6a8452877b0bbbf355b81753090e3e85665003cce192f693,2019-09,Wiltshire Police,Wiltshire Police,-1.780485,51.566576,On or near GOOCH STREET,E01015480,Swindon 015D,Unable to prosecute suspect
81cc7941f4439974da11a07c78fc7a18276dec438b9a8fe94309820b9928e955,2019-09,Wiltshire Police,Wiltshire Police,-1.754366,51.573052,On or near Shopping Area,E01015549,Swindon 009A,Suspect charged
f8b31afd7ff5f4b79de3ff2949e8e5a64e423fbff780a2bc325a1dfcc537deaf,2019-09,Wiltshire Police,Wiltshire Police,-1.783767,51.562051,On or near Supermarket,E01032714,Swindon 019E,Investigation complete; no suspect identified
bd1bc9c735df774934f545e71eee80b1a623fa611f10ca8ef5505795d506bab2,2019-09,Wiltshire Police,Wiltshire Police,-1.743748,51.536704,On or near Park/Open Space,E01015583,Swindon 025A,Investigation complete; no suspect identified
71a4069b6ca087724441fd81a66bced9ec698228d3cd898642c68b2a73e2e540,2019-09,Wiltshire Police,Wiltshire Police,-1.793754,51.583468,On or near THAMES AVENUE,E01015527,Swindon 007C,Investigation complete; no suspect identified
e707b66d08dc2ac2bb5cd737e4fe2090f980b94d87805f1323e1c3b74fb7b419,2019-09,Wiltshire Police,Wiltshire Police,-1.746629,51.545082,On or near Pedestrian Subway,E01015535,Swindon 024C,Investigation complete; no suspect identified
04cc8c2712051ad6b68340019ad5dd86ccb8e49aaadf379e2cc2c6898d3362e2,2019-09,Wiltshire Police,Wiltshire Police,-1.721961,51.418452,On or near Sports/Recreation Area,E01031861,Wiltshire 019A,Unable to prosecute suspect
4d674ff7c018fd601e7222a5e2c9b27ba39a726b7d46f23b5074d38c6414fd89,2019-09,Wiltshire Police,Wiltshire Police,-1.823682,51.588534,On or near HYSOPP CLOSE,E01015525,Swindon 026A,Investigation complete; no suspect identified
9416d163009d317bbc04a6321037c51c4ea34a67b6b19c17f3d85a35219bdf78,2019-09,Wiltshire Police,Wiltshire Police,-1.748366,51.562106,On or near CLEVEDON CLOSE,E01015538,Swindon 016A,Unable to prosecute suspect
a2c68231146bed789c24f5954d834f49a3e52540fc8946ad9dc988db01bfeb84,2019-09,Wiltshire Police,Wiltshire Police,-1.986422,51.358438,On or near QUAKERS ROAD,E01032693,Wiltshire 025H,Unable to prosecute suspect
0279005bd506d21f61304e2a30af405995afb2747eff082ee54b784a30272ddc,2019-09,Wiltshire Police,Wiltshire Police,-1.755554,51.556043,On or near RUTLAND ROAD,E01015573,Swindon 016C,Action to be taken by another organisation
2456a385a8231752ced1bd46598d36803729cf64911908d2e812a5b041147828,2019-09,Wiltshire Police,Wiltshire Police,-2.113819,51.460168,On or near Park/Open Space,E01031912,Wiltshire 011B,Unable to prosecute suspect
75f42a6c77ffebb9a83bbeec345c04bee7f9c3ee82def60693746637fb289010,2019-09,Wiltshire Police,Wiltshire Police,-2.125172,51.453431,On or near ST LUKES DRIVE,E01031912,Wiltshire 011B,Unable to prosecute suspect
a38b84d0f9ade9cdadcbe9ff71a8b0ec7fbb03fbf38bba7624c74bbcf6f04a3b,2019-09,Wiltshire Police,Wiltshire Police,-1.796497,51.060468,On or near ST NICHOLAS' ROAD,E01032009,Wiltshire 058B,Investigation complete; no suspect identified
f54ea428f71a14901c9fdd59dc8c869074fb9c17a66234a4c72ac255403fb2b2,2019-09,Wiltshire Police,Wiltshire Police,-1.769408,51.568884,On or near Petrol Station,E01015479,Swindon 017A,Investigation complete; no suspect identified
80d3c6b84e657f7c5e9eae4875b1bff6a8f8803672d50dc672b8e6ab77bc201b,2019-09,Wiltshire Police,Wiltshire Police,-1.998901,51.439840,On or near THE KNAPP,E01031896,Wiltshire 015B,Offender given a caution
f94af47a8a6c81bebd9a327b94ee0297796000eb8b915ce5ea901acac66b59b2,2019-09,Wiltshire Police,Wiltshire Police,-1.784082,51.553554,On or near LANSDOWN ROAD,E01015497,Swindon 019D,Further investigation is not in the public interest
5d8e1e7ace8ff9367c8d8ab2207273f230d61a242555bb38acd7cba13baa1519,2019-09,Wiltshire Police,Wiltshire Police,-2.135325,51.373259,On or near BYRON CLOSE,E01032062,Wiltshire 022A,Unable to prosecute suspect
eef2e64d1ed997e9bcb855c225e4a587332827f7f38e41068e990c2d4b6e0d74,2019-09,Wiltshire Police,Wiltshire Police,-1.968438,51.362454,On or near NAUGHTON AVENUE,E01032692,Wiltshire 025G,Unable to prosecute suspect
6cb698c51bf24dfe22b9fc9eefc3803fa73836cd1c48b3b3d7a8d5db3356f1df,2019-09,Wiltshire Police,Wiltshire Police,-1.770475,51.082621,On or near CHURCH ROAD,E01032011,Wiltshire 057B,Local resolution
3854878156ec8ebbf5502d81fbd6799620bdd4da8a17d9af460f9d2cfa73d03d,2019-09,Wiltshire Police,Wiltshire Police,-1.819748,51.590587,On or near BURNET CLOSE,E01015525,Swindon 026A,Unable to prosecute suspect
78bb6aa4613fe72d3e3fb924615c6fca1ec675f907eac46a13f444aedb1af811,2019-09,Wiltshire Police,Wiltshire Police,-2.117700,51.463752,On or near PARK LANE,E01031912,Wiltshire 011B,Investigation complete; no suspect identified
182130c78dd96359f0d55799d2f54150fb5d539dd41d0583650c243cb8969945,2019-09,Wiltshire Police,Wiltshire Police,-1.708776,51.628578,On or near KINGS AVENUE,E01015520,Swindon 001B,Investigation complete; no suspect identified
c7a3aac0833f5634bfad2d0043a07c2e0dbc66de0e085f1db5bb0011e332ab7b,2019-09,Wiltshire Police,Wiltshire Police,-1.784955,51.561001,On or near Shopping Area,E01015494,Swindon 019A,Suspect charged
31c33a1949ac90ff1efc023fd30042d31a252430ac66d3b2f351a916ec8c5a8e,2019-09,Wiltshire Police,Wiltshire Police,-1.980565,51.352466,On or near KEMP CLOSE,E01031851,Wiltshire 025B,Investigation complete; no suspect identified
c6948921cb586b34beaa06021a5bbe14b914862e87bc762ec49b015598082bef,2019-09,Wiltshire Police,Wiltshire Police,-2.230289,51.307885,On or near WEBBERS COURT,E01032091,Wiltshire 036D,Unable to prosecute suspect
65f98e26ddfb6669fb68c894b8c12d01f39bf60a82be50d52a37fb7fc392f7a3,2019-09,Wiltshire Police,Wiltshire Police,-2.116635,51.373702,On or near SNARLTON LANE,E01032071,Wiltshire 021E,Unable to prosecute suspect
dfc930b68850cc1078b37f6866d74ca834afd4e250e74bf9ddb77b5cecdab395,2019-09,Wiltshire Police,Wiltshire Police,-1.903036,51.031308,On or near BUTT LANE,E01031990,Wiltshire 054A,Unable to prosecute suspect
88cb6a32adb32dce424686042a3b15f88af2eb89ad72c33cf69ba8e4aba8b6fa,2019-09,Wiltshire Police,Wiltshire Police,-1.841664,51.547748,On or near Petrol Station,E01015503,Swindon 022C,Unable to prosecute suspect
ba53b479f527db9a31a201a1f72602a00f8e6d321aa4918c302319da6f3100c4,2019-09,Wiltshire Police,Wiltshire Police,-1.786244,51.563044,On or near Nightclub,E01015476,Swindon 015B,Unable to prosecute suspect
6adc2c19db85addf663b40eb0cfd4dd953a4aedc591a877d9044deac97ff7ef4,2019-09,Wiltshire Police,Wiltshire Police,-2.227446,51.321963,On or near LYNWOOD DRIVE,E01032097,Wiltshire 033B,Unable to prosecute suspect
19986141b6e89bf0e18280c5d12ec231ecddd06c604ab94a589a8406c6c56fb5,2019-09,Wiltshire Police,Wiltshire Police,-1.994695,51.354815,On or near COUCH LANE,E01031854,Wiltshire 026B,Unable to prosecute suspect
8c34bc19644a83186f896a33e76654179a8ff2066f7002e484887236117b96e5,2019-09,Wiltshire Police,Wiltshire Police,-1.790813,51.064792,On or near FRIAR'S ORCHARD,E01032023,Wiltshire 059D,Investigation complete; no suspect identified
f202a6304e4431feecc48b2fdead54a01232c393edc657a9a1d45e7717a252d6,2019-09,Wiltshire Police,Wiltshire Police,-1.796845,51.173490,On or near STONEHENGE ROAD,E01031979,Wiltshire 048F,Investigation complete; no suspect identified
29eec8d86061eb42fedbb4f4a644c961373480bd4892ac58798fd821e681cd38,2019-09,Wiltshire Police,Wiltshire Police,-1.773893,51.551737,On or near HIGH STREET,E01015534,Swindon 024B,Unable to prosecute suspect
57dc20a459e5f4b6dcfe34d7a692fd5715eb385722c0d4cd6934cc3394e02793,2019-09,Wiltshire Police,Wiltshire Police,-1.730896,51.420164,On or near Supermarket,E01031863,Wiltshire 019C,Investigation complete; no suspect identified
f7755c0f873590257258ad59ec66aa1d1b083d4f6088758abea7a243e79c6867,2019-09,Wiltshire Police,Wiltshire Police,-2.142950,51.353855,On or near Police Station,E01032070,Wiltshire 021D,Offender given a caution
c4672c4ddd71a6a564063938950b1873ba121b38643a9e8ce6b3fa2d9a1a0435,2019-09,Wiltshire Police,Wiltshire Police,-1.882084,51.543443,On or near BAILEY'S MEAD,E01031969,Wiltshire 006D,Investigation complete; no suspect identified
f595fbbd3d9ab6a51ba77e53bbaea789ac2e39f64b48a40b920a57d53cd6462f,2019-09,Wiltshire Police,Wiltshire Police,-2.263368,51.091802,On or near WHITE ROAD,E01032037,Wiltshire 050D,Unable to prosecute suspect
50598f2a8ed82134f1e506c901189e3fa7a2caa3cf63df588bf5246a84e167e1,2019-09,Wiltshire Police,Wiltshire Police,-1.808071,51.559431,On or near CALLENDERS,E01015579,Swindon 012C,Investigation complete; no suspect identified
29fac383565b6c3b6eb0d243d0cdfceb20207eb273258363a51dd8808fb0f517,2019-09,Wiltshire Police,Wiltshire Police,-2.121674,51.464080,On or near FLEET ROAD,E01031919,Wiltshire 009E,Investigation complete; no suspect identified
3c46bd203f4cb67d9b3216e54be15293cbf794e0c943d7845b5eeb118d73e1e8,2019-09,Wiltshire Police,Wiltshire Police,-2.138661,51.464286,On or near LAMBERTS,E01031908,Wiltshire 010C,Offender given a caution
8904a1da012498ce425eba516d7db32a1c40906a1313504ed251efed51831b42,2019-09,Wiltshire Police,Wiltshire Police,-2.207499,51.315634,On or near CLOTHIER LEAZE,E01032094,Wiltshire 035C,Unable to prosecute suspect
2db0f0a3978cb6ca7a3952a374e63f27ca964f2a14f344d746733a61210e3c5a,2019-09,Wiltshire Police,Wiltshire Police,-2.178274,51.205199,On or near Police Station,E01032103,Wiltshire 044A,Investigation complete; no suspect identified
7defa6e115daff1c244b7e02d26615851bf6bdee8bdfa9a97f1e75887b522ff1,2019-09,Wiltshire Police,Wiltshire Police,-1.748314,51.550705,On or near ROSEDALE ROAD,E01015541,Swindon 020D,Investigation complete; no suspect identified
