Crime ID,Month,Reported by,Falls within,Longitude,Latitude,Location,LSOA code,LSOA name,Outcome type
3cd2ac10b26f89ca8dda461e6d9d494354b97304248ece66dd6d3a41dab27dc1,2019-09,Wiltshire Police,Wiltshire Police,-1.776511,51.553145,On or near ALBERT STREET,E01032715,Swindon 019F,Investigation complete; no suspect identified
0e1a2a56d8d92f4c993f9d8ab54374bddfeedc26fb1652a841db262c36ac3ee7,2019-09,Wiltshire Police,Wiltshire Police,-1.768197,51.574348,On or near DUNBEATH ROAD,E01015509,Swindon 010B,Investigation complete; no suspect identified
a1f779baca2bd6e6a766612dbcccfc8c44d38dcc0fb2037a95d4ce7d89ba8e9c,2019-09,Wiltshire Police,Wiltshire Police,-1.885855,51.586372,On or near RESTROP VIEW,E01031955,Wiltshire 003B,Unable to prosecute suspect
87668f9ab76d12a601b19aa05ceba0d4ec8f26fff58b0e4c874b9912a5c2a343,2019-09,Wiltshire Police,Wiltshire Police,-1.780284,51.082352,On or near LOVETT GREEN,E01031986,Wiltshire 051C,Unable to prosecute suspect
b7325e1ed55eda6033040c2a587e6a4f3978c2a95992a26318cf68795ce33c12,2019-09,Wiltshire Police,Wiltshire Police,-2.146957,51.178815,On or near GREENHILL,E01032082,Wiltshire 047E,Investigation complete; no suspect identified
8c46f58be2ecef583c4c7d6b203a6a485f960597e6c0b4432f37e3e1d22dbc01,2019-09,Wiltshire Police,Wiltshire Police,-1.986508,51.359184,On or near PALMER ROAD,E01032693,Wiltshire 025H,Unable to prosecute suspect
3145830a05a775afeec14b507b0d81e353b89899b187ea5c8ca72ae61c7ec13d,2019-09,Wiltshire Police,Wiltshire Police,-1.964804,51.362947,On or near HOPGOOD CLOSE,E01031844,Wiltshire 034A,Unable to prosecute suspect
dffe3079cdce90849333ccaf0e0febdf989c44957bf8a922d8bd129b67339fcc,2019-09,Wiltshire Police,Wiltshire Police,-1.768766,51.170533,On or near BRAMLEY WAY,E01031975,Wiltshire 048B,Unable to prosecute suspect
8d154c3422ef43ea4e3c8a31844b05304a6c2a4d5230f825c7b471a5d979d5cf,2019-09,Wiltshire Police,Wiltshire Police,-1.741517,51.114492,On or near ELLIOTT GREEN,E01032034,Wiltshire 049D,Unable to prosecute suspect
f6e4f9a86c3ff1960e1deaf020f291d95c1ff1883c83072f33e00ec3752dc618,2019-09,Wiltshire Police,Wiltshire Police,-1.775387,51.564732,On or near ROSEBERY STREET,E01015480,Swindon 015D,Investigation complete; no suspect identified
1fa9843d58ce2645fb2795fe4f141eadb05be9df284d752e74dcc0c3739be654,2019-09,Wiltshire Police,Wiltshire Police,-1.791064,51.575245,On or near DEVON ROAD,E01015580,Swindon 007D,Unable to prosecute suspect
153e525bfe0dd2e5c2430cc62bbcab114e07dd83cf29b844c3021039f3daa0c4,2019-09,Wiltshire Police,Wiltshire Police,-2.263112,51.438087,On or near OGBOURNE,E01031929,Wiltshire 017D,Unable to prosecute suspect
6e83d5446f5aeaee682f9238f841b29c8a59601761f5142666b1e19729c2042b,2019-09,Wiltshire Police,Wiltshire Police,-1.846716,51.567796,On or near DANESTONE CLOSE,E01015565,Swindon 011C,Unable to prosecute suspect
26be2202615671e8566dc17457226e5b166a88bcc4c5a9eb57c345096e67c425,2019-09,Wiltshire Police,Wiltshire Police,-1.854946,51.561297,On or near Park/Open Space,E01015504,Swindon 018C,Investigation complete; no suspect identified
f353f799ecc78b14a0f36b9815ae3da87bb0d5fed4a80ff336ea4a5de0dd165c,2019-09,Wiltshire Police,Wiltshire Police,-1.801171,51.583859,On or near CHURCH WALK NORTH,E01015529,Swindon 006C,Investigation complete; no suspect identified
0c9ffe53d02482faef03322ee7625f3516d4654f19af656bf8798768363e07d7,2019-09,Wiltshire Police,Wiltshire Police,-1.723610,51.514675,On or near Petrol Station,E01015588,Swindon 025F,Investigation complete; no suspect identified
66a4a6dcc1a2f5e9c942389e3336921491019fa1aba2e614c432a35ca592bef8,2019-09,Wiltshire Police,Wiltshire Police,-2.180147,51.204693,On or near MARKET PLACE,E01032103,Wiltshire 044A,Unable to prosecute suspect
6d0eed38e8b809b5e04e687dba6fa0ffcd82ec9d2f00faf5e74282096e9dbfaa,2019-09,Wiltshire Police,Wiltshire Police,-2.056749,51.043878,On or near ROOKERY LANE,E01032031,Wiltshire 061D,Investigation complete; no suspect identified
c2605c80eded44993339c2a2fa681e698608ff17d46f771cb566053d61b91949,2019-09,Wiltshire Police,Wiltshire Police,-2.106099,51.464194,On or near DARCY CLOSE,E01031918,Wiltshire 011E,Investigation complete; no suspect identified
c2671e0f21b4701504c6da6fc4df9f7c487a58b1e1ddf0acd36b25acabf13bfb,2019-09,Wiltshire Police,Wiltshire Police,-1.722143,51.564052,On or near SANDPIPER BRIDGE,E01015485,Swindon 013E,Unable to prosecute suspect
3bba1f77693a99e02eb1117d0f0d368d9283d9a91aa5eb0d8e3bc0092ba4d8d6,2019-09,Wiltshire Police,Wiltshire Police,-2.106763,51.452802,On or near Petrol Station,E01031917,Wiltshire 011D,Unable to prosecute suspect
31ad020a7ae371dcbf070208d913813713816537a884215ca5df219d578f7481,2019-09,Wiltshire Police,Wiltshire Police,-1.745244,51.552892,On or near SHERWOOD ROAD,E01015539,Swindon 020B,Investigation complete; no suspect identified
2b5f5043a8451ebeb167eed62b9860202cf06a6d1bc5d022f39f762b4f9f0947,2019-09,Wiltshire Police,Wiltshire Police,-1.804094,51.079472,On or near Sports/Recreation Area,E01032019,Wiltshire 053B,Investigation complete; no suspect identified
80d43c05f4117a4206f76f05de5e0891bc5a125cb3e0223ee4dcf91a4db68a48,2019-09,Wiltshire Police,Wiltshire Police,-2.192585,51.437163,On or near MANOR ROAD,E01031952,Wiltshire 018F,Investigation complete; no suspect identified
daedc249dfb36e8e6a746464f01ddf1f288a3b297742fa66e5e0c69e2d724dc7,2019-09,Wiltshire Police,Wiltshire Police,-1.769408,51.568884,On or near Petrol Station,E01015479,Swindon 017A,Investigation complete; no suspect identified
3899099f6234cf2a1cc1879d95ee2f0a0ac4b072546189c28944d3dd6be61550,2019-09,Wiltshire Police,Wiltshire Police,-2.248815,51.414848,On or near UPPER LEY,E01031890,Wiltshire 017C,Investigation complete; no suspect identified
f30666e0b2c7332b3cf16f0a2aaea9c61ebf11ea7f83eaaab89930c8b6fc0f95,2019-09,Wiltshire Police,Wiltshire Police,-1.786285,51.594217,On or near ALLINGTON ROAD,E01015545,Swindon 003C,Unable to prosecute suspect
d74d1e2572305f18014de73989b7bfadf0bf89720c0e1f143e1a39299aa6cc99,2019-09,Wiltshire Police,Wiltshire Police,-1.898598,51.535295,On or near CLOATLEY CRESCENT,E01031966,Wiltshire 007G,Unable to prosecute suspect
2519711959911b6651f2360fc93bd4a3adfc52fe43d7b171eb7a213b29af67b3,2019-09,Wiltshire Police,Wiltshire Police,-2.121791,51.416092,On or near CHURCH STREET,E01031942,Wiltshire 018E,Investigation complete; no suspect identified
7ed3cb45e40d06b9a5c85f57c5e1d1bd8d043b15cd67ddcb60a135df424d9fc8,2019-09,Wiltshire Police,Wiltshire Police,-2.222117,51.320786,On or near Supermarket,E01032085,Wiltshire 031A,Suspect charged
8f776c44bba8470c9de0273a588e1d635166677f77ce1d8a2513546a5a34e6d9,2019-09,Wiltshire Police,Wiltshire Police,-1.802184,51.529984,On or near VICTORIA CROSS ROAD,E01015586,Swindon 025D,Unable to prosecute suspect
16ea148f506ffa8cff8e375f6b1745f18ff616a3f70555bd65f8a739c3825b40,2019-09,Wiltshire Police,Wiltshire Police,-1.657997,51.236820,On or near COMPTON ROAD,E01031880,Wiltshire 041E,Unable to prosecute suspect
30689f08c944a052fa0a06207c49e978a4fdfc8bdec45699e93a1302801c5a9d,2019-09,Wiltshire Police,Wiltshire Police,-1.783744,51.579206,On or near PINEHURST ROAD,E01015508,Swindon 010A,Unable to prosecute suspect
a18efc986ecc12f8fc51276783396877db0220d2d7778c19bf34fbc2a93564dc,2019-09,Wiltshire Police,Wiltshire Police,-2.188810,51.205542,On or near Conference/Exhibition Centre,E01032114,Wiltshire 044D,Investigation complete; no suspect identified
7b6d74d4544758f2565c39cea2e0c9f5af2055eb48cdb12b0f81e2a1a9d597f2,2019-09,Wiltshire Police,Wiltshire Police,-2.112524,51.471822,On or near HEATHFIELD,E01031914,Wiltshire 009C,Investigation complete; no suspect identified
e97b2bc674debb65badcaeaf8dcf64a199af5e288241ebf0f096dd6d88cd91ed,2019-09,Wiltshire Police,Wiltshire Police,-1.783661,51.572382,On or near KITCHENER STREET,E01015511,Swindon 010D,Investigation complete; no suspect identified
b0ed13f25fa014ed1551407f261395c6cc2cef4f0ac1f2bd74dc5a783fcadb0e,2019-09,Wiltshire Police,Wiltshire Police,-2.249428,51.419109,On or near THE WHARF,E01031890,Wiltshire 017C,Investigation complete; no suspect identified
14c0d2ae14b34060fd6e6d30604baddd1e02da528bb8e4cc10fc85288c872943,2019-09,Wiltshire Police,Wiltshire Police,-1.588099,51.348886,On or near PICCADILLY,E01031877,Wiltshire 029D,Unable to prosecute suspect
5a4da84a65178f3f0fbd0857fe837d405667098853ce11b004c9c1ee3d430f8e,2019-09,Wiltshire Police,Wiltshire Police,-2.185828,51.101231,On or near B3089,E01032010,Wiltshire 050A,Investigation complete; no suspect identified
cab55520e8498a55120bac4e08177513accef2617b6085484eddfebb02189efa,2019-09,Wiltshire Police,Wiltshire Police,-2.197180,51.324940,On or near SPRINGFIELD PARK,E01032099,Wiltshire 032A,Investigation complete; no suspect identified
59d472ce61120ea8b6a3319a165a4807d1ee9489c78ee1d6bda3b9cf0e6e63cc,2019-09,Wiltshire Police,Wiltshire Police,-1.790429,51.562683,On or near LONDON STREET,E01015477,Swindon 015C,Investigation complete; no suspect identified
924be8da2223ef9019ba48657cc6125f9c6f4979648dac853ac3b970b6ebe617,2019-09,Wiltshire Police,Wiltshire Police,-2.140630,51.374674,On or near Supermarket,E01032062,Wiltshire 022A,Unable to prosecute suspect
01dac0289aa0912f250d0c3b4ffa38a7c4276d01d496cef90dfef165f9ea323c,2019-09,Wiltshire Police,Wiltshire Police,-1.785940,51.560184,On or near Supermarket,E01015494,Swindon 019A,Investigation complete; no suspect identified
9c5377b1648c910a21521de25d8ff12a53ec98e2aafb649877323edcde88f4aa,2019-09,Wiltshire Police,Wiltshire Police,-2.199471,51.340393,On or near Petrol Station,E01032079,Wiltshire 030C,Unable to prosecute suspect
fcc9a16de9341092800bc1a7570a74f7033fa4a03cb4e9353367bc77a0d93ab0,2019-09,Wiltshire Police,Wiltshire Police,-1.774124,51.581022,On or near JEFFERIES AVENUE,E01015560,Swindon 005F,Investigation complete; no suspect identified
65166cf26f5c7d5a5f0c6e6fa28dddafe9a4c59f405cdc305657a8878679788f,2019-09,Wiltshire Police,Wiltshire Police,-1.777749,51.170533,On or near NURSERY CLOSE,E01031979,Wiltshire 048F,Investigation complete; no suspect identified
20400e5e7f832180ab2451d97d093afaff53822427ccd14d520f9a3eec67c31b,2019-09,Wiltshire Police,Wiltshire Police,-2.080681,51.066488,On or near Supermarket,E01032030,Wiltshire 061C,Investigation complete; no suspect identified
7a171a5643417f35bc35cb1978d2edb833377a5ce173f897f1e863b146f1a7ef,2019-09,Wiltshire Police,Wiltshire Police,-1.751553,50.992849,On or near THE BOROUGH,E01031995,Wiltshire 062E,Unable to prosecute suspect
8fe488f7bd5b89d14538efbd1d49d9007ddf0b1c55bca5cc8958533971c69333,2019-09,Wiltshire Police,Wiltshire Police,-1.810285,51.073628,On or near Sports/Recreation Area,E01032003,Wiltshire 055C,Unable to prosecute suspect
2d933b9ad70e308d24269968853be170723732d7a9e397c90118d1ee7ad3251b,2019-09,Wiltshire Police,Wiltshire Police,-1.812825,51.603146,On or near TIPPETT AVENUE,E01032711,Swindon 027D,Investigation complete; no suspect identified
ccb40ee541d591fdc7e7ddd281cd38f8d5cbd47c6d94b10c39c0ed2c4c93f2c4,2019-09,Wiltshire Police,Wiltshire Police,-1.757166,51.551326,On or near KELHAM CLOSE,E01015542,Swindon 020E,Investigation complete; no suspect identified
a05ee7aaf614889c856fda6b67615ca4d564b0f3b80852559fbaed5f6a355fae,2019-09,Wiltshire Police,Wiltshire Police,-1.789930,51.558375,On or near CURTIS STREET,E01015494,Swindon 019A,Unable to prosecute suspect
109f8a6dbdfd4633cbd172a88618ba7775aa1851961f261f9878e5f4ff296535,2019-09,Wiltshire Police,Wiltshire Police,-1.947129,51.031561,On or near CHALK PYT ROAD,E01031990,Wiltshire 054A,Investigation complete; no suspect identified
8925c3e51ce286ee9dc3578c818b5460bf0dba8c71301dcf127616db44260e55,2019-09,Wiltshire Police,Wiltshire Police,-1.647425,51.013516,On or near GREEN CLOSE,E01031972,Wiltshire 060C,Unable to prosecute suspect
c2ce94cb46f4ea3ae690ca052cfbd6f324405fdb33da35b2fe754b199ebd9053,2019-09,Wiltshire Police,Wiltshire Police,-2.135723,51.376568,On or near Sports/Recreation Area,E01032062,Wiltshire 022A,Unable to prosecute suspect
b99cce7220de531c876680c49e038a9512e06079b9350fdbce4ead0919fc5d02,2019-09,Wiltshire Police,Wiltshire Police,-1.797670,51.073014,On or near Parking Area,E01032014,Wiltshire 056A,Unable to prosecute suspect
81fbcc0b10faef1467e9f816f8f2722fa84976e5b7d6625aec53b7853653a65f,2019-09,Wiltshire Police,Wiltshire Police,-1.836069,51.579938,On or near BOTLEY COPSE,E01015562,Swindon 011A,Suspect charged
b1c8da050ff79a7a7375f6ba06caf00e6938535bf8c27c27a61e6fe74be479eb,2019-09,Wiltshire Police,Wiltshire Police,-1.623324,51.252018,On or near NEW DROVE,E01031878,Wiltshire 041C,Investigation complete; no suspect identified
66906cb8a944ff88436bed657ba296a54c9ed01caf05ef0d93b7e24505c5e8d7,2019-09,Wiltshire Police,Wiltshire Police,-1.762258,51.340286,On or near HIGH STREET,E01031870,Wiltshire 024C,Investigation complete; no suspect identified
901606ef3d8f95a796625df373b27e44b952b68243836c78bd4816b6086b38bf,2019-09,Wiltshire Police,Wiltshire Police,-2.113819,51.460168,On or near Park/Open Space,E01031912,Wiltshire 011B,Unable to prosecute suspect
848623c0ffd76b2f36e345afcd559622857c441c73ede26c352b344e5c584963,2019-09,Wiltshire Police,Wiltshire Police,-1.758863,51.552220,On or near Pedestrian Subway,E01015540,Swindon 020C,Investigation complete; no suspect identified
ad99e0035c1c3fa25d538127ccf75e9eb3ed95d06a106110e3c4146663398539,2019-09,Wiltshire Police,Wiltshire Police,-1.824969,51.554117,On or near KIRKSTALL CLOSE,E01015570,Swindon 022E,Unable to prosecute suspect
88c01cea0278d89cfe4ed761f91af477ceb4e7f003d6fa7e749ec73dcccf7b81,2019-09,Wiltshire Police,Wiltshire Police,-2.204629,51.202701,On or near SAXONS ACRE,E01032110,Wiltshire 043A,Local resolution
1f8f342da08811c32aa882ccb49b0122a2ea09bfe334a2492e36220249587884,2019-09,Wiltshire Police,Wiltshire Police,-2.144959,51.457643,On or near TURPIN WAY,E01031909,Wiltshire 010D,Unable to prosecute suspect
8d4bc53948a5c840b04ac3759015226f1aaef242417c4915ddf046f4c785c3d3,2019-09,Wiltshire Police,Wiltshire Police,-2.095830,51.584778,On or near ABBOTTS GARDEN,E01031949,Wiltshire 002D,Unable to prosecute suspect
e2a4934321b22cfb1dfe65b8f616c429adbea7631c42ccad12b398b1886acd2e,2019-09,Wiltshire Police,Wiltshire Police,-1.725815,51.586764,On or near ASH GARDENS,E01015473,Swindon 008A,Suspect charged
99ef4feda739efbae28175ca517f08bd3b7a2c86fd6a6420f35d76bdaee422ba,2019-09,Wiltshire Police,Wiltshire Police,-1.795692,51.068388,On or near NEW CANAL,E01032022,Wiltshire 058C,Investigation complete; no suspect identified
319eff509c757041bd46b83fd7460481e94d55a680bca8829ce0a7f687f101de,2019-09,Wiltshire Police,Wiltshire Police,-1.994178,51.352540,On or near Parking Area,E01031854,Wiltshire 026B,Unable to prosecute suspect
06fc002f5e0009517c2d08e150f7be33716ae5b969be7d2913a6ae2b65a355d8,2019-09,Wiltshire Police,Wiltshire Police,-2.280579,51.457100,On or near PINEWOOD WAY,E01031930,Wiltshire 017E,Investigation complete; no suspect identified
e02e8f3ef35176913a789a4785cfac0b0404302a12787320c34f085145002904,2019-09,Wiltshire Police,Wiltshire Police,-1.713300,51.637283,On or near PENTYLANDS CLOSE,E01015521,Swindon 001C,Unable to prosecute suspect
d074689c3cad13c3c07561b4366f138191de6c7b856fa918e082e20b344077a4,2019-09,Wiltshire Police,Wiltshire Police,-1.787574,51.540649,On or near FROGDEN ROAD,E01015536,Swindon 024D,Investigation complete; no suspect identified
00ebeecadf989ff8c409a7ddefc2d06b80c7d6d83102834dfe506c76341585b3,2019-09,Wiltshire Police,Wiltshire Police,-1.798952,51.583001,On or near Supermarket,E01015529,Swindon 006C,Investigation complete; no suspect identified
05cfccc5458a96278f6632cf37a4062b14ef69ecd088b50d501ce21bbf6543cd,2019-09,Wiltshire Police,Wiltshire Police,-1.730530,51.347843,On or near CROSSROADS,E01031866,Wiltshire 024A,Investigation complete; no suspect identified
1e21448ad19e34d03f5bd2bdd361fa393c90d86ba27f5654247d82ffb2143654,2019-09,Wiltshire Police,Wiltshire Police,-2.104263,51.492169,On or near Park/Open Space,E01031939,Wiltshire 008A,Investigation complete; no suspect identified
823e645f5d8853f58620312963be18621b5bd90b10b6e53cfe61b445dc21c29c,2019-09,Wiltshire Police,Wiltshire Police,-1.831777,51.600981,On or near LUNA CLOSE,E01032705,Swindon 026D,Suspect charged
10b16cc99a20b02f39e45faf7c1ad1aa3cd77ed2471fd7bbb977927c349aa2c1,2019-09,Wiltshire Police,Wiltshire Police,-2.128562,51.374400,On or near GLOUCESTER SQUARE,E01032062,Wiltshire 022A,Unable to prosecute suspect
dc9f2dda2b826da6a3cc1a328c2e48a33012b2738ab70d9f3e6b7d410d9d972e,2019-09,Wiltshire Police,Wiltshire Police,-1.770660,51.172299,On or near COLTSFOOT CLOSE,E01031975,Wiltshire 048B,Investigation complete; no suspect identified
76564393fa1b4afa6b561b985521e5a9335ef1efe6d8f611b800f311fbcfcf90,2019-09,Wiltshire Police,Wiltshire Police,-1.617891,51.257540,On or near RECREATION ROAD,E01031859,Wiltshire 041A,Investigation complete; no suspect identified
b0f74786bb66dfb19dd917a3b5da7e7e5a1236296bf9e5226530c020c9c55314,2019-09,Wiltshire Police,Wiltshire Police,-1.801959,51.084756,On or near Sports/Recreation Area,E01032019,Wiltshire 053B,Unable to prosecute suspect
faadfef4f01af4621ea58816a43b1779717a3dd919d5110eb1482fe373a4be63,2019-09,Wiltshire Police,Wiltshire Police,-1.794336,51.068305,On or near Shopping Area,E01032022,Wiltshire 058C,Unable to prosecute suspect
2049e51f26971bca2d9442b5cf50474d8b042e4aba175d39df10b4229d7a72b9,2019-09,Wiltshire Police,Wiltshire Police,-2.209009,51.303618,On or near Shopping Area,E01032092,Wiltshire 035A,Suspect charged
4b74be45b4d6071afe9d8e7dd16c51d7caece532423beab0dd170fd9c357591a,2019-09,Wiltshire Police,Wiltshire Police,-1.743673,50.993012,On or near CHURCH HATCH,E01031995,Wiltshire 062E,Investigation complete; no suspect identified
b8855e1293b64cf3f0fef18ceb8c3e7600e387a3d2380ac8c43b4695cd592294,2019-09,Wiltshire Police,Wiltshire Police,-1.606368,51.254399,On or near HYSON CRESCENT,E01031860,Wiltshire 041B,Unable to prosecute suspect
293061492e2868f74abf9e4cc9d6c9aedd36cd2c71d7092e5d51cf7cbf0961e9,2019-09,Wiltshire Police,Wiltshire Police,-1.766303,51.572249,On or near GIPSY LANE,E01015509,Swindon 010B,Investigation complete; no suspect identified
d869d839f72d38aab3bacae0b976275445b61c6971581d0c578eb31e55167f5c,2019-09,Wiltshire Police,Wiltshire Police,-1.926480,51.085332,On or near DAIRY ROAD,E01032004,Wiltshire 054B,Investigation complete; no suspect identified
98ff70b9d98e9ca620c1a28e1c0abc4180c3e68fba505a4fc871c9d900909dee,2019-09,Wiltshire Police,Wiltshire Police,-2.116835,51.457575,On or near GLADSTONE ROAD,E01031912,Wiltshire 011B,Unable to prosecute suspect
be09ab393269ab07f572976c77a86254e16fb1ac61643ea7e822b115b7a02077,2019-09,Wiltshire Police,Wiltshire Police,-1.755805,51.571050,On or near Parking Area,E01015549,Swindon 009A,Suspect charged
a86cc3a056b797099435ddb44772123b743de6010888c131d00a97f037ce99f6,2019-09,Wiltshire Police,Wiltshire Police,-2.161211,51.200989,On or near QUEENSWAY,E01032104,Wiltshire 042A,Suspect charged
043b12f79692cd6bd40e7d3644af801e2d7967403cf732a7ae32b0827a313bf8,2019-09,Wiltshire Police,Wiltshire Police,-1.827105,51.079580,On or near OLD DAIRY CLOSE,E01031983,Wiltshire 052D,Investigation complete; no suspect identified
5ac26eb3bd0f714b5b56b497617f51c21b8f9c7a7d7a481cd0b2f6285062cac0,2019-09,Wiltshire Police,Wiltshire Police,-1.760317,51.560890,On or near ASHLEY CLOSE,E01015573,Swindon 016C,Unable to prosecute suspect
1559dfda8f48ada906f369bc39bc9f432a850f7def50ffd7ccdc28d78cda1b9e,2019-09,Wiltshire Police,Wiltshire Police,-2.265761,51.438342,On or near ROCKFIELD,E01031929,Wiltshire 017D,Investigation complete; no suspect identified
08b08301901c9c05468e4681b47284b0282d588a197bb8c2409fcb2ba930f351,2019-09,Wiltshire Police,Wiltshire Police,-2.213215,51.316810,On or near NEWTOWN,E01032089,Wiltshire 036B,Unable to prosecute suspect
c658c99539310e56699a30f4a6f0d0fb02246be9ca11cecc078e06be3e17245d,2019-09,Wiltshire Police,Wiltshire Police,-1.813018,51.559637,On or near ASHWORTH ROAD,E01032708,Swindon 012F,Investigation complete; no suspect identified
0df7e64ed538e9b7205b82ee5e5ba0b9de059959dfcab519e5e5d85e21aabcc8,2019-09,Wiltshire Police,Wiltshire Police,-1.864017,51.080978,On or near CROW LANE,E01032039,Wiltshire 054E,Investigation complete; no suspect identified
5636a9dbd9a466cc471d6d3b54663f438c98cad1e5472108c13fe8aaee4ee6c3,2019-09,Wiltshire Police,Wiltshire Police,-1.748374,50.993202,On or near GREEN LANE,E01031995,Wiltshire 062E,Investigation complete; no suspect identified
7cbf16c7338ae48aa03bff9040b33065d003edc1faef7a95f8bedc9e0429ab02,2019-09,Wiltshire Police,Wiltshire Police,-2.194131,51.435363,On or near CHARLES STREET,E01031952,Wiltshire 018F,Unable to prosecute suspect
d7085ddede508b0b2ef54ac18ea7159733a0dac15613fe1d1d3ae5c6b0d23423,2019-09,Wiltshire Police,Wiltshire Police,-1.828772,51.559131,On or near Shopping Area,E01015569,Swindon 022D,Investigation complete; no suspect identified
57a3114fa1c4caf7834b862ad78f909ab8e651941ab3b36bde846c2b602c6c9d,2019-09,Wiltshire Police,Wiltshire Police,-2.125172,51.453431,On or near ST LUKES DRIVE,E01031912,Wiltshire 011B,Action to be taken by another organisation
8258401d7db2f46e63711603f073a8d93a6603cab74d8880c48d304a1bfe0e83,2019-09,Wiltshire Police,Wiltshire Police,-1.606490,51.292112,On or near WHITE LANE,E01031849,Wiltshire 029C,Unable to prosecute suspect
08dbf1a6fac6a7edd2de9bee0d1cee05e0a928d5ec642cd286464a4f43594548,2019-09,Wiltshire Police,Wiltshire Police,-2.113819,51.460168,On or near Park/Open Space,E01031912,Wiltshire 011B,Unable to prosecute suspect
0d5163f5c791e330adfcdb48f984ed64527f1a1c6d30dca0a35f4341a352fd57,2019-09,Wiltshire Police,Wiltshire Police,-1.830407,51.553945,On or near FRESHBROOK WAY,E01015569,Swindon 022D,Unable to prosecute suspect
e0921f1615013c2ed9ebc131844a77e5ab3e86e3992c3e3f4f777d382cdd3e71,2019-09,Wiltshire Police,Wiltshire Police,-1.792123,51.065370,On or near THE FRIARY,E01032023,Wiltshire 059D,Unable to prosecute suspect
bc62c57efe65a37e25f5ea2bdf24582dbe17d9d5357e1ff14d3503e77fa7a427,2019-09,Wiltshire Police,Wiltshire Police,-2.184835,51.253017,On or near WELLHEAD LANE,E01032695,Wiltshire 040H,Unable to prosecute suspect
6d318bff20c68b84bb40edb1929ad883d2929c6fe56e85677a581a891211bb46,2019-09,Wiltshire Police,Wiltshire Police,-2.140515,51.463295,On or near MANOR ROAD,E01031908,Wiltshire 010C,Unable to prosecute suspect
b737bf57790ee23a0fdea07046ab46297835ebedddba9333ed43c4c24c1121dd,2019-09,Wiltshire Police,Wiltshire Police,-1.785196,51.561954,On or near Shopping Area,E01015476,Swindon 015B,Suspect charged
4806b4555e1e26db967e858f9ef9db832e591fcb6639da916ef962fc768d328c,2019-09,Wiltshire Police,Wiltshire Police,-1.760449,51.191279,On or near LEDGER HILL CLOSE,E01031989,Wiltshire 046A,Suspect charged
06e4e1969d41aaa3e4630e3a55ef613f1cedfcfbebc5c9dce4e5f4e6cbf54011,2019-09,Wiltshire Police,Wiltshire Police,-1.796752,51.070737,On or near Supermarket,E01032014,Wiltshire 056A,Investigation complete; no suspect identified
b1f175ae556f747bc2ead5ea73a5fd6d3e24bde213d7ef5d0fee36b0b30ba6c1,2019-09,Wiltshire Police,Wiltshire Police,-2.144616,51.376620,On or near Further/Higher Educational Building,E01032062,Wiltshire 022A,Investigation complete; no suspect identified
7a378ae5b99138afcb4d7d67903a94f5345c6fdc4a4eeb333ed600707558387e,2019-09,Wiltshire Police,Wiltshire Police,-2.139722,51.495917,On or near PADDOCK END,E01031940,Wiltshire 008B,Investigation complete; no suspect identified
5392960f972a2cf1bf929e3ece5c39019eb70db76f13d2e38caad94728d2251b,2019-09,Wiltshire Police,Wiltshire Police,-2.114810,51.470624,On or near HILL RISE,E01031914,Wiltshire 009C,Investigation complete; no suspect identified
4533560356662e71810af4a4c1b16ead942819946399bf35a30c03b51cd27296,2019-09,Wiltshire Police,Wiltshire Police,-1.792214,51.560421,On or near TAUNTON STREET,E01015476,Swindon 015B,Unable to prosecute suspect
c5e0e8f08ec9017ab76d08676d986c7bec6bc391efa1e1c0e5dbf89887f72846,2019-09,Wiltshire Police,Wiltshire Police,-1.771515,51.562990,On or near A4259,E01015479,Swindon 017A,Investigation complete; no suspect identified
d653d45bbc32c8c4876a25117fb628400c951de61c8aaa6fcffd94e203846f35,2019-09,Wiltshire Police,Wiltshire Police,-1.984317,51.339942,On or near GREEN LANE,E01032688,Wiltshire 025E,Unable to prosecute suspect
586ed818ab9c3ccdad486b4ef0bf89b13fe291af987baf4b21011b3cbed91ba0,2019-09,Wiltshire Police,Wiltshire Police,-1.779460,51.569766,On or near SUFFOLK STREET,E01015511,Swindon 010D,Investigation complete; no suspect identified
b4cb1ed43da27e982eeffd42d5878a63ae231f65cb880aec9ed318bf7d1f0e33,2019-09,Wiltshire Police,Wiltshire Police,-1.991522,51.351074,On or near SHEEP STREET,E01031856,Wiltshire 026D,Unable to prosecute suspect
c7fdfe7d296c927f1b9d204e94378587fcdaef3e927181c1813562166719ec78,2019-09,Wiltshire Police,Wiltshire Police,-1.767377,51.596483,On or near LOVERIDGE CLOSE,E01015556,Swindon 005B,Investigation complete; no suspect identified
497ad7faf737882595719dfbd8e89dd4fc8205380afe0fa0b5b02c3c2d0663dd,2019-09,Wiltshire Police,Wiltshire Police,-1.752232,51.596713,On or near KINGSDOWN ROAD,E01015557,Swindon 005C,Investigation complete; no suspect identified
c361c82dee81ae184d29131790202ae648a7785021d5964db2009f65199b2542,2019-09,Wiltshire Police,Wiltshire Police,-2.183341,51.259133,On or near WARMINSTER ROAD,E01032119,Wiltshire 040E,Investigation complete; no suspect identified
48f4366a33964226643c0bc84ba822b3991daaca6cb48d902b80efc895b71396,2019-09,Wiltshire Police,Wiltshire Police,-1.815074,51.604130,On or near VAUGHAN WILLIAMS WAY,E01032712,Swindon 027E,Investigation complete; no suspect identified
6df241a0ea9099c5f16c2b08aaa873e8221c9e3cc226c69cbc844e18919bca1e,2019-09,Wiltshire Police,Wiltshire Police,-1.740760,51.346544,On or near B3087,E01031866,Wiltshire 024A,Investigation complete; no suspect identified
4c70700558aab99bf816b8d786311a001ee876b26cc6a4d6a111696027dc11d4,2019-09,Wiltshire Police,Wiltshire Police,-1.768337,51.589337,On or near REVELL CLOSE,E01015555,Swindon 005A,Unable to prosecute suspect
